ori.src,tok.ori.src,mut.src,tok.mut.src,mutkind,mutkind_word,tag,mut_align,ref,poly_word,corpus,ori.tgt,mut.tgt,tok.ori.tgt,tok.mut.tgt,ori.alignment,mut.alignment,ori.sc_id,ori.tgt_sense,mut.sc_id,mut.tgt_sense,unfair,ori.right,mut.right,sc_id
"Given the sensitive nature of the subjects investigated by the Panel it should be noted that many individuals spoke on condition of confidentiality.
",Given the sensitive nature of the subjects investigated by the Panel it should be noted that many individuals spoke on condition of confidentiality . ,"Given the sensitive nature of the subjects investigated by the Panel it should be noted that an individual spokes on condition of confidentiality.
",Given the sensitive nature of the subjects investigated by the Panel it should be noted that an individual spokes on condition of confidentiality . ,plural,['individuals '],MUTATED,"0-0,1-1,2-2,3-3,4-4,5-5,6-6,7-7,8-8,9-9,10-10,11-11,12-12,13-13,14-14,15-15,17-17,18-18,19-19,20-20,21-21,22-22,23-23,24-24","应该指出，鉴于专家团所调查问题的敏感性质，很多个人在参加面谈时都以不公开身份为条件。
",subject-6,UNv1,"鉴于专家小组调查对象的敏感性质,应当指出,许多个人发言的条件是保密。","鉴于专家小组调查的课题的敏感性质,应当指出,个人在保密条件下发言。","鉴 于 专 家 小 组 调 查 对 象 的 敏 感 性 质 , 应 当 指 出 , 许 多 个 人 发 言 的 条 件 是 保 密 。","鉴 于 专 家 小 组 调 查 的 课 题 的 敏 感 性 质 , 应 当 指 出 , 个 人 在 保 密 条 件 下 发 言 。","0-0 0-1 1-1 2-11 2-12 3-13 3-14 4-10 6-8 6-9 7-6 7-7 10-2 10-3 10-4 10-5 12-16 13-16 13-17 14-15 14-18 14-19 14-20 15-23 16-21 16-22 17-24 19-28 20-28 20-29 21-27 22-25 22-26 22-31 22-32 22-33
","0-0 0-1 1-1 2-12 2-13 3-14 3-15 4-8 6-9 6-10 7-6 7-7 8-11 10-2 10-3 10-4 10-5 12-17 13-17 13-18 14-16 14-19 14-20 14-21 15-22 16-22 17-23 18-27 19-24 20-28 22-25 22-26
",4,"[('对', 8), ('象', 9)]",0,"[('课', 9), ('题', 10)]",1,0,1,0
"How about sharing a plate of spring rolls and salad.
",How about sharing a plate of spring rolls and salad . ,"How about sharing plates of spring rolls and salad.
",How about sharing plates of spring rolls and salad . ,singular,['plate '],MUTATED,"0-0,1-1,2-2,4-3,5-4,6-5,7-6,8-7,9-8,10-9,11-10","咱们来共享一份春卷和撒拉吧.
",spring-6,cwmt,不如一起分享一盘春卷和沙拉,不如分享弹簧卷和沙拉的盘子吧,不 如 一 起 分 享 一 盘 春 卷 和 沙 拉,不 如 分 享 弹 簧 卷 和 沙 拉 的 盘 子 吧,"0-1 1-1 2-3 2-4 2-5 3-2 3-6 4-7 5-6 6-8 7-9 8-10 9-11 9-12
","0-1 1-2 2-3 3-11 3-12 4-6 4-10 5-4 5-5 6-6 7-7 8-8 8-9
",3,"[('春', 8)]",1,"[('弹', 4), ('簧', 5)]",1,1,0,3
"Gets a list of all castles under this ruler.
",Gets a list of all castles under this ruler . ,"Gets lists of all castles under this ruler.
",Gets lists of all castles under this ruler . ,singular,['list '],MUTATED,"0-0,2-1,3-2,4-3,5-4,6-5,7-6,8-7,9-8,10-9","相反地，关注给予，好事也开始出现了。
",ruler-8,cwmt,获得一份在此尺下的所有城堡的清单。,获得这个统治者统治下所有城堡的名单,获 得 一 份 在 此 尺 下 的 所 有 城 堡 的 清 单 。,获 得 这 个 统 治 者 统 治 下 所 有 城 堡 的 名 单,"0-0 0-1 1-2 2-3 3-8 4-9 4-10 5-11 5-12 6-4 6-7 7-5 8-6
","0-0 0-1 1-15 1-16 2-14 3-10 3-11 4-12 4-13 5-9 6-2 6-3 7-4 7-5 7-6 7-7 7-8
",1,"[('尺', 6)]",0,"[('统', 4), ('治', 5), ('者', 6), ('统', 7), ('治', 8)]",1,0,1,0
"But I can very easily imagine a collection of defined predicative generic functions working happily for a long time before the ambiguous case is encountered.
",But I can very easily imagine a collection of defined predicative generic functions working happily for a long time before the ambiguous case is encountered . ,"But I can very easily imagine collections of defined predicative generic functions working happily for a long time before the ambiguous case is encountered.
",But I can very easily imagine collections of defined predicative generic functions working happily for a long time before the ambiguous case is encountered . ,singular,['collection '],MUTATED,"0-0,1-1,2-2,3-3,4-4,5-5,7-6,8-7,9-8,10-9,11-10,12-11,13-12,14-13,15-14,16-15,17-16,18-17,19-18,20-19,21-20,22-21,23-22,24-23,25-24,26-25","其实我最担心的是全备重量。
",case-22,cwmt,"但我可以非常容易地想象,在出现模棱两可的情况之前,在很长一段时间内,一系列定义明确的通用通用功能在愉快地工作。","但我可以非常容易地想象,在遇到模棱两可的案件之前,我早就可以愉快地工作了很长时间,收集了定义明确的通用通用功能。","但 我 可 以 非 常 容 易 地 想 象 , 在 出 现 模 棱 两 可 的 情 况 之 前 , 在 很 长 一 段 时 间 内 , 一 系 列 定 义 明 确 的 通 用 通 用 功 能 在 愉 快 地 工 作 。","但 我 可 以 非 常 容 易 地 想 象 , 在 遇 到 模 棱 两 可 的 案 件 之 前 , 我 早 就 可 以 愉 快 地 工 作 了 很 长 时 间 , 收 集 了 定 义 明 确 的 通 用 通 用 功 能 。","0-0 1-1 2-2 2-3 3-4 3-5 4-6 4-7 5-9 5-10 7-35 7-36 8-41 9-37 9-38 9-39 9-40 10-24 11-42 11-43 11-44 11-45 12-46 12-47 13-48 13-52 13-53 14-49 14-50 14-51 15-29 16-28 16-34 17-27 18-30 18-31 19-22 19-23 20-32 21-15 21-16 21-17 22-20 22-21 24-54
","0-0 1-1 2-2 2-3 3-4 3-5 4-6 4-7 5-9 5-10 6-41 6-42 7-48 8-44 8-45 8-46 8-47 9-24 10-49 10-50 10-51 10-52 11-53 11-54 12-33 12-34 13-30 13-31 13-32 14-33 16-37 17-38 17-39 18-22 18-23 20-15 20-16 20-17 21-20 21-21 22-27 23-13
",11,"[('情', 20), ('况', 21)]",14,"[('案', 20), ('件', 21)]",1,0,1,14
"regarding our stock jackets , we are enclosing a list for your perusal.
","regarding our stock jackets , we are enclosing a list for your perusal . ","Regarding our stock jackets , we are enclosing lists for your perusal.
","Regarding our stock jackets , we are enclosing lists for your perusal . ",singular,['list '],MUTATED,"0-0,1-1,2-2,3-3,4-4,5-5,6-6,7-7,9-8,10-9,11-10,12-11,13-12,14-13","关于我方夹克现货，现附上明细清单一份供你方研究斟酌。
",stock-2,cwmt,"关于我们的股票夹克, 我们附上一份清单 供你阅读。","关于我们的库存夹克, 我们附上清单 供你阅读。","关 于 我 们 的 股 票 夹 克 , 我 们 附 上 一 份 清 单 供 你 阅 读 。","关 于 我 们 的 库 存 夹 克 , 我 们 附 上 清 单 供 你 阅 读 。","0-0 0-1 1-3 2-5 2-6 3-7 3-8 4-9 5-10 5-11 6-11 7-12 7-13 8-14 9-15 9-16 9-17 10-18 11-19 12-20 12-21 12-22
","0-0 0-1 1-3 2-5 2-6 3-7 3-8 4-9 5-10 5-11 6-11 7-12 7-13 8-14 8-15 9-16 10-17 11-18 11-19 11-20
",2,"[('股', 5), ('票', 6)]",7,"[('库', 5), ('存', 6)]",1,0,1,7
"These are the quarter attention when leading a cadre to answer.
",These are the quarter attention when leading a cadre to answer . ,"These are the quarter attention when leading cadres to answer.
",These are the quarter attention when leading cadres to answer . ,singular,['cadre '],MUTATED,"0-0,1-1,2-2,3-3,4-4,5-5,6-6,8-7,9-8,10-9,11-10,12-11","这些都是领导干部应时刻关注的.
",quarter-3,cwmt,这些是领导干部回答问题的季度关注点。,这些是领导干部回应时的四分之一关注。,这 些 是 领 导 干 部 回 答 问 题 的 季 度 关 注 点 。,这 些 是 领 导 干 部 回 应 时 的 四 分 之 一 关 注 。,"0-0 0-1 1-2 2-10 2-11 3-12 3-13 4-14 4-15 4-16 6-3 6-4 8-5 8-6 10-7 10-8
","0-0 0-1 1-2 2-10 3-11 3-12 3-13 3-14 4-15 4-16 5-9 6-3 6-4 7-5 7-6 8-8 9-17
",8,"[('季', 12), ('度', 13)]",7,"[('四', 11), ('分', 12), ('之', 13), ('一', 14)]",1,1,0,8
"In the specific case of Chernobyl, many individuals and families migrated to other countries.
","In the specific case of Chernobyl , many individuals and families migrated to other countries . ","In the specific case of Chernobyl, an individual and families migrateds to other countries.
","In the specific case of Chernobyl , an individual and families migrateds to other countries . ",plural,['individuals '],MUTATED,"0-0,1-1,2-2,3-3,4-4,5-5,6-6,8-8,9-9,10-10,11-11,12-12,13-13,14-14,15-15,16-16","在切尔诺贝利这一具体事例中，许多个人和家庭移居其它国家。
",case-3,UNv1,"就切尔诺贝利这一具体案例而言,许多个人和家庭移徙到其他国家。","就切尔诺贝利的具体情况而言,一个个人和家庭移徙到其他国家。","就 切 尔 诺 贝 利 这 一 具 体 案 例 而 言 , 许 多 个 人 和 家 庭 移 徙 到 其 他 国 家 。","就 切 尔 诺 贝 利 的 具 体 情 况 而 言 , 一 个 个 人 和 家 庭 移 徙 到 其 他 国 家 。","0-14 1-5 2-8 2-9 3-10 3-11 4-10 5-12 5-13 6-15 6-16 7-17 7-18 8-19 9-20 9-21 10-22 10-23 10-24 11-24 12-25 12-26 13-27
","0-13 1-8 2-7 3-9 3-10 4-8 5-11 5-12 6-14 6-15 7-16 7-17 8-18 9-19 9-20 10-21 10-22 11-23 12-24 12-25 13-26
",14,"[('案', 10), ('例', 11)]",11,"[('情', 9), ('况', 10)]",1,0,1,11
"This course site features a selection of student term projects, along with lecture notes and other materials used by students in the course.
","This course site features a selection of student term projects , along with lecture notes and other materials used by students in the course . ","This course site features selections of student term projects, along with lecture notes and other materials used by students in the course.
","This course site features selections of student term projects , along with lecture notes and other materials used by students in the course . ",singular,['selection '],MUTATED,"0-0,1-1,2-2,3-3,5-4,6-5,7-6,8-7,9-8,10-9,11-10,12-11,13-12,14-13,15-14,16-15,17-16,18-17,19-18,20-19,21-20,22-21,23-22,24-23,25-24","在中国经济进入完全市场经济时代的形势下，人防行业企业间的竞争也日趋激烈。
",term-8,cwmt,"该课程网站有部分学生术语项目,以及讲课笔记和学生在课程中使用的其他材料。","该课程的选修点包括学生学期项目,以及讲课笔记和学生在课程中使用的其他材料。","该 课 程 网 站 有 部 分 学 生 术 语 项 目 , 以 及 讲 课 笔 记 和 学 生 在 课 程 中 使 用 的 其 他 材 料 。","该 课 程 的 选 修 点 包 括 学 生 学 期 项 目 , 以 及 讲 课 笔 记 和 学 生 在 课 程 中 使 用 的 其 他 材 料 。","0-0 1-1 2-3 2-4 3-5 3-6 4-5 5-6 6-6 6-7 7-8 7-9 8-10 8-11 9-12 9-13 9-14 10-16 12-17 12-18 13-19 13-20 14-21 15-31 15-32 16-33 16-34 17-28 17-29 18-28 19-22 19-23 20-24 20-27 22-26
","0-0 1-1 2-6 4-4 5-3 5-7 5-8 6-9 6-10 6-11 7-12 8-13 8-14 8-15 9-17 11-18 11-19 12-20 12-21 13-22 14-32 14-33 15-34 15-35 16-29 16-30 17-29 18-23 18-24 19-25 19-28 21-27
",0,"[('术', 10), ('语', 11)]",1,"[('期', 12)]",1,0,1,1
"It is inadvisable to enter a sauna directly after taking a hot spring bath, to avoid causing damage to the corneas.
","It is inadvisable to enter a sauna directly after taking a hot spring bath , to avoid causing damage to the corneas . ","It is inadvisable to enter saunas directly after taking a hot spring bath, to avoid causing damage to the corneas.
","It is inadvisable to enter saunas directly after taking a hot spring bath , to avoid causing damage to the corneas . ",singular,['sauna '],MUTATED,"0-0,1-1,2-2,3-3,4-4,6-5,7-6,8-7,9-8,10-9,11-10,12-11,13-12,14-13,15-14,16-15,17-16,18-17,19-18,20-19,21-20,22-21,23-22","泡完温泉后不宜直接进入烤箱，以免造成眼角膜伤害。
",spring-12,cwmt,"为避免对角膜造成损坏,不宜在洗春浴后直接进入桑拿室。","为了避免对角膜造成破坏,不宜在温泉洗完澡后直接进入桑拿室。","为 避 免 对 角 膜 造 成 损 坏 , 不 宜 在 洗 春 浴 后 直 接 进 入 桑 拿 室 。","为 了 避 免 对 角 膜 造 成 破 坏 , 不 宜 在 温 泉 洗 完 澡 后 直 接 进 入 桑 拿 室 。","2-4 2-5 3-3 4-20 4-21 6-22 6-23 7-18 7-19 8-17 9-12 11-16 12-15 13-14 13-16 15-0 15-1 15-2 16-6 16-7 17-8 17-9 20-24
","2-5 2-6 3-4 4-23 4-24 5-25 5-26 6-21 6-22 7-18 7-20 8-19 9-19 10-15 11-16 12-17 14-2 14-3 15-7 15-8 16-9 16-10 19-27
",3,"[('春', 15)]",4,"[('泉', 16)]",1,0,1,4
"In a case that arises out of the posting of political graffiti, a State might reflect on whether or not to proffer charges.
","In a case that arises out of the posting of political graffiti , a State might reflect on whether or not to proffer charges . ","In a case that arises out of the posting of political graffiti, States might reflect on whether or not to proffer charges.
","In a case that arises out of the posting of political graffiti , States might reflect on whether or not to proffer charges . ",singular,['State '],MUTATED,"0-0,1-1,2-2,3-3,4-4,5-5,6-6,7-7,8-8,9-9,10-10,11-11,12-12,14-13,15-14,16-15,17-16,18-17,19-18,20-19,21-20,22-21,23-22,24-23,25-24","对于一桩绘制政治性""涂鸦画""的案件，国家可能会考虑是否应提出指控。
",case-2,UNv1,"在因张贴政治涂鸦而产生的案件中,一国可以考虑是否提出指控。","如果由于张贴政治涂鸦而出现这种情况,各国可以考虑是否提出指控。","在 因 张 贴 政 治 涂 鸦 而 产 生 的 案 件 中 , 一 国 可 以 考 虑 是 否 提 出 指 控 。","如 果 由 于 张 贴 政 治 涂 鸦 而 出 现 这 种 情 况 , 各 国 可 以 考 虑 是 否 提 出 指 控 。","0-0 2-12 2-13 4-9 4-10 5-25 7-7 8-2 8-3 9-11 10-4 10-5 11-17 12-16 13-17 14-18 15-20 16-6 17-21 17-22 17-23 18-23 19-23 20-24 21-24 22-26 22-27 22-28
","0-10 2-15 2-16 3-3 3-13 3-14 4-2 4-12 5-11 7-6 8-4 8-5 10-7 11-19 12-18 12-19 13-20 14-22 15-8 16-23 16-24 16-25 17-25 18-25 19-26 20-26 21-28 21-29 21-30
",14,"[('案', 12), ('件', 13)]",11,"[('情', 15), ('况', 16)]",1,1,0,14
"The first boot takes a while as the system configures itself.
",The first boot takes a while as the system configures itself . ,"The first boot takes whiles as the system configures itself.
",The first boot takes whiles as the system configures itself . ,singular,['while '],MUTATED,"0-0,1-1,2-2,3-3,5-4,6-5,7-6,8-7,9-8,10-9,11-10,12-11","第一次引导需要一段时间，因为系统自身需要配置。
",boot-2,um,第一个启动系统在系统配置时需要一段时间。 NAME OF TRANSLATORS,第一个靴子随着系统本身的配置而需要时间。,第 一 个 启 动 系 统 在 系 统 配 置 时 需 要 一 段 时 间 。 NAME OF TRANSLATORS,第 一 个 靴 子 随 着 系 统 本 身 的 配 置 而 需 要 时 间 。,"0-0 1-0 1-1 2-3 2-4 3-13 3-14 4-15 5-16 5-17 5-18 6-15 7-7 8-5 8-6 8-8 8-9 9-10 9-11 9-20 9-21 9-22 10-19 10-22
","0-0 0-2 1-0 1-1 2-3 2-4 3-15 3-16 4-17 4-18 5-5 6-11 7-7 7-8 8-12 8-13 9-19
",6,"[('启', 3), ('动', 4)]",4,"[('靴', 3), ('子', 4)]",1,1,0,6
"An orangutan cools down with a fan at South Korea's Everland amusement and animal park.
",An orangutan cools down with a fan at South Korea 's Everland amusement and animal park . ,"Orangutans cool down with a fan at South Korea's Everland amusement and animal park.
",Orangutans cool down with a fan at South Korea 's Everland amusement and animal park . ,singular,['orangutan '],MUTATED,"1-0,2-1,3-2,4-3,5-4,6-5,7-6,8-7,9-8,10-9,11-10,12-11,13-12,14-13,15-14,16-15,17-16","在韩国的一家动物园里，一只猩猩靠小风扇吹来的徐徐凉风解暑降温。
",fan-6,um,一只猩猩在韩国的长城游乐场 和动物公园 和风扇一起冷却下来,南韩长城游乐场和动物公园的粉丝们 都冷静下来了,一 只 猩 猩 在 韩 国 的 长 城 游 乐 场 和 动 物 公 园 和 风 扇 一 起 冷 却 下 来,南 韩 长 城 游 乐 场 和 动 物 公 园 的 粉 丝 们 都 冷 静 下 来 了,"0-0 1-1 1-2 1-3 2-24 3-25 4-22 6-19 6-20 7-4 8-5 9-5 9-6 10-17 11-10 11-11 11-12 11-17 12-13 12-18 13-14 13-15 14-16 14-17
","0-16 1-18 2-19 5-13 5-14 6-2 7-0 8-1 9-17 10-4 10-5 10-6 11-7 12-8 12-9 13-10 13-11
",0,"[('风', 19), ('扇', 20)]",1,"[('粉', 13), ('丝', 14)]",1,0,1,1
"We have many patterns in stock for you to choose from.
",We have many patterns in stock for you to choose from . ,"We have a pattern in stock for you to choose from.
",We have a pattern in stock for you to choose from . ,plural,['patterns '],MUTATED,"0-0,1-1,3-3,4-4,5-5,6-6,7-7,8-8,9-9,10-10,11-11,12-12","我们有多种现存的式样供你选择。
",stock-5,um,我们的股票有很多模式可供你选择,我们有一个供你们选择的库存模式。,我 们 的 股 票 有 很 多 模 式 可 供 你 选 择,我 们 有 一 个 供 你 们 选 择 的 库 存 模 式 。,"0-0 0-1 1-5 2-6 2-7 3-8 3-9 4-5 5-3 5-4 6-11 7-12 8-11 9-13 9-14 10-14
","0-0 0-1 1-2 2-3 2-4 3-13 3-14 5-11 5-12 6-5 7-6 9-8 9-9 10-10 10-15
",2,"[('股', 3), ('票', 4)]",7,"[('库', 11), ('存', 12)]",1,0,1,7
"We took the decision to withdraw a quantity of stock from sale.
",We took the decision to withdraw a quantity of stock from sale . ,"We took the decision to withdraw quantities of stock from sale.
",We took the decision to withdraw quantities of stock from sale . ,singular,['quantity '],MUTATED,"0-0,1-1,2-2,3-3,4-4,5-5,7-6,8-7,9-8,10-9,11-10,12-11,13-12","我们决定将一批存货下架。
",stock-9,cwmt,我们决定从销售中提取一定数量的股票,我们决定从销售中提取库存数量。,我 们 决 定 从 销 售 中 提 取 一 定 数 量 的 股 票,我 们 决 定 从 销 售 中 提 取 库 存 数 量 。,"0-0 0-1 1-4 2-7 3-2 3-3 4-8 5-9 6-10 7-12 7-13 8-12 8-14 9-15 9-16 10-14 11-5
","0-0 0-1 2-7 3-2 3-3 4-8 5-9 6-12 6-13 7-12 8-10 8-11 9-4 10-5 10-6
",2,"[('股', 15), ('票', 16)]",7,"[('库', 10), ('存', 11)]",1,0,1,7
"Let a man of spirit venture where he pleases, and never tip his golden cup empty toward the moon!
","Let a man of spirit venture where he pleases , and never tip his golden cup empty toward the moon ! ","Let men of spirit venture where he pleases, and never tip his golden cup empty toward the moon!
","Let men of spirit venture where he pleases , and never tip his golden cup empty toward the moon ! ",singular,['man '],MUTATED,"0-0,2-1,3-2,4-3,5-4,6-5,7-6,8-7,9-8,10-9,11-10,12-11,13-12,14-13,15-14,16-15,17-16,18-17,19-18,20-19,21-20","人生得意须尽欢，莫使金樽空对月。
",spirit-4,um,"让一个有精神的人去他想去的地方冒险, 永远不要把他的金杯空空地朝月亮倾注!",让神灵们去他想去的地方冒险 永远不要把他的金杯空投在月亮上!,"让 一 个 有 精 神 的 人 去 他 想 去 的 地 方 冒 险 , 永 远 不 要 把 他 的 金 杯 空 空 地 朝 月 亮 倾 注 !",让 神 灵 们 去 他 想 去 的 地 方 冒 险 永 远 不 要 把 他 的 金 杯 空 投 在 月 亮 上 !,"0-0 1-1 1-2 1-3 2-7 3-6 4-4 4-5 5-15 5-16 6-8 6-13 6-14 7-9 8-15 9-17 10-18 10-19 10-20 11-33 12-23 12-24 13-25 14-26 15-27 15-28 16-30 17-29 18-31 18-32
","0-0 1-3 2-1 3-2 4-11 4-12 5-4 5-9 5-10 6-5 7-11 8-13 9-13 9-14 9-15 10-17 11-18 11-19 12-20 13-21 14-22 15-24 16-27 17-25 17-26 17-28
",3,"[('精', 4), ('神', 5)]",2,"[('灵', 2)]",1,1,0,3
"A noodle shop delivery worker lured a teenager to bed claiming he could exorcise the evil spirit he claimed was possessing her.
",A noodle shop delivery worker lured a teenager to bed claiming he could exorcise the evil spirit he claimed was possessing her . ,"A noodle shop delivery worker lured teenagers to bed claiming he could exorcise the evil spirit he claimed was possessing her.
",A noodle shop delivery worker lured teenagers to bed claiming he could exorcise the evil spirit he claimed was possessing her . ,singular,['teenager '],MUTATED,"0-0,1-1,2-2,3-3,4-4,5-5,7-6,8-7,9-8,10-9,11-10,12-11,13-12,14-13,15-14,16-15,17-16,18-17,19-18,20-19,21-20,22-21,23-22","一名面档送外卖工人向一名青年声称可以帮她驱鬼来引诱她上床。
",spirit-16,um,"一家面条店的送货工人引诱一名青少年上床睡觉,声称他可以驱除他声称拥有她的邪恶精神。","一家面条店的送货工人引诱青少年上床睡觉,声称他可以驱除他声称拥有她的邪灵。","一 家 面 条 店 的 送 货 工 人 引 诱 一 名 青 少 年 上 床 睡 觉 , 声 称 他 可 以 驱 除 他 声 称 拥 有 她 的 邪 恶 精 神 。","一 家 面 条 店 的 送 货 工 人 引 诱 青 少 年 上 床 睡 觉 , 声 称 他 可 以 驱 除 他 声 称 拥 有 她 的 邪 灵 。","0-0 1-2 1-3 2-1 2-4 3-6 3-7 4-8 4-9 5-10 5-11 6-12 7-14 7-15 7-16 8-19 9-17 9-18 9-20 10-22 10-23 11-24 12-25 12-26 13-27 13-28 14-27 15-36 15-37 16-38 16-39 17-29 18-31 19-34 20-32 20-33 21-34
","0-0 1-2 1-3 2-1 2-4 3-6 3-7 4-8 4-9 5-10 5-11 6-12 6-13 6-14 8-15 8-16 8-17 8-18 9-20 9-21 10-22 11-23 11-24 12-25 12-26 13-25 14-34 15-35 16-27 17-29 18-32 19-30 19-31 20-32
",3,"[('精', 38), ('神', 39)]",2,"[('灵', 35)]",1,0,1,2
"They see this pot. They rub it, a genie comes out.
","They see this pot . They rub it , a genie comes out . ","They see this pot. They rub it, genies come out.
","They see this pot . They rub it , genies come out . ",singular,['genie '],MUTATED,"0-0,1-1,2-2,3-3,4-4,5-5,6-6,7-7,8-8,10-9,11-10,12-11,13-12,14-13","然后看见了一个瓶子 他们擦了一下瓶子,出现了一只妖精
",pot-3,os18,"他们看到这个锅子,他们擦它,一个精灵出来。","他们看到这个大麻,他们摩擦它,精灵出来","他 们 看 到 这 个 锅 子 , 他 们 擦 它 , 一 个 精 灵 出 来 。","他 们 看 到 这 个 大 麻 , 他 们 摩 擦 它 , 精 灵 出 来","0-0 0-1 1-2 1-3 2-4 3-6 3-7 4-9 4-10 5-11 6-12 6-13 7-14 7-15 8-16 8-17 9-19 10-18 10-20
","0-0 0-1 1-2 1-3 2-4 2-5 3-6 3-7 4-9 4-10 5-11 5-12 6-13 6-14 7-15 7-16 8-18 9-17
",0,"[('锅', 6), ('子', 7)]",1,"[('大', 6), ('麻', 7)]",1,1,0,0
"Bulkier thAN a column but smaller thAN a wall pier cAN support AN arch or beam.
",Bulkier thAN a column but smaller thAN a wall pier cAN support AN arch or beam . ,"Bulkier thAN a column but smaller thAN a wall pier cAN support arches or beam.
",Bulkier thAN a column but smaller thAN a wall pier cAN support arches or beam . ,singular,['arch '],MUTATED,"0-0,1-1,2-2,3-3,4-4,5-5,6-6,7-7,8-8,9-9,10-10,11-11,13-12,14-13,15-14,16-15,17-16","体积比柱子大，比墙小.可用来支持拱门或横梁。
",beam-15,um,Bulkier than a 专栏但小一点的THAN CAN码头支持AN拱门或波束。,"Bulkier than a 列,但小于该列 墙码头cAN支持拱门或梁。",Bulkier than a 专 栏 但 小 一 点 的 THAN CAN 码 头 支 持 AN 拱 门 或 波 束 。,"Bulkier than a 列 , 但 小 于 该 列 墙 码 头 cAN 支 持 拱 门 或 梁 。","0-0 0-1 1-0 1-2 2-2 3-3 3-4 4-5 5-6 6-10 7-7 9-12 9-13 10-16 11-14 11-15 12-16 13-17 13-18 14-19 15-20 15-21 15-22
","0-0 0-1 1-0 1-2 1-3 2-2 3-3 4-5 5-6 6-9 8-10 9-11 9-12 10-13 11-14 11-15 12-16 12-17 13-18 14-19 14-20
",1,"[('波', 20), ('束', 21), ('。', 22)]",2,"[('梁', 19), ('。', 20)]",1,0,1,2
"I had a boner with a capital ""O"".
","I had a boner with a capital "" O "" . ","I had boners with a capital ""O"".
","I had boners with a capital "" O "" . ",singular,['boner '],MUTATED,"0-0,1-1,3-2,4-3,5-4,6-5,7-6,8-7,9-8,10-9,11-10","我的老二硬得像石头一样
",capital-6,os18,"我有一个勃起 与资本""O""。","我用""O""这个首字母发了脾气","我 有 一 个 勃 起 与 资 本 "" O "" 。","我 用 "" O "" 这 个 首 字 母 发 了 脾 气","0-0 1-1 2-2 2-3 3-4 3-5 4-6 5-8 6-7 7-9 7-10 7-11 7-12
","0-0 1-10 3-6 3-9 4-6 4-8 5-7 6-12 6-13
",0,"[('资', 7)]",3,"[('首', 7)]",1,0,1,1
"A person travelling westwards sets his watch behind at each successive time zone.
",A person travelling westwards sets his watch behind at each successive time zone . ,"People travelling westwards set his watch behind at each successive time zone.
",People travelling westwards set his watch behind at each successive time zone . ,singular,['person '],MUTATED,"1-0,2-1,3-2,4-3,5-4,6-5,7-6,8-7,9-8,10-9,11-10,12-11,13-12,14-13","一个向西旅行的人，在每个时区边界，要把他的表拨慢一小时。
",watch-6,um,向西旅行的人在每一个连续的时区都把守着。,向西旅行的人把他的手表放在每一个连续的时区。,向 西 旅 行 的 人 在 每 一 个 连 续 的 时 区 都 把 守 着 。,向 西 旅 行 的 人 把 他 的 手 表 放 在 每 一 个 连 续 的 时 区 。,"0-8 1-5 2-2 2-3 3-0 3-1 5-12 5-16 6-17 6-18 8-6 9-7 10-10 10-11 11-13 12-14
","0-5 1-2 1-3 2-0 2-1 3-6 4-7 4-8 5-9 5-10 6-11 7-12 8-13 8-15 9-16 9-17 10-19 11-20 11-21
",7,"[('守', 17), ('着', 18)]",3,"[('手', 9), ('表', 10)]",1,0,1,3
"An autocrat prefers his subjects to be automatons , rather than intelligent human beings.
","An autocrat prefers his subjects to be automatons , rather than intelligent human beings . ","Autocrats prefer his subjects to be automatons , rather than intelligent human beings.
","Autocrats prefer his subjects to be automatons , rather than intelligent human beings . ",singular,['autocrat '],MUTATED,"1-0,2-1,3-2,4-3,5-4,6-5,7-6,8-7,9-8,10-9,11-10,12-11,13-12,14-13,15-14","独裁者希望他的国民都是自动调节器，像智能机器人。
",subject-4,cwmt,"独裁者更喜欢他的主体是自制人, 而不是聪明人。","独裁者更喜欢他的臣民是自制人, 而不是聪明人。","独 裁 者 更 喜 欢 他 的 主 体 是 自 制 人 , 而 不 是 聪 明 人 。","独 裁 者 更 喜 欢 他 的 臣 民 是 自 制 人 , 而 不 是 聪 明 人 。","0-2 1-0 1-1 2-3 2-4 2-5 3-6 3-7 4-8 4-9 5-11 6-10 7-12 8-14 9-15 9-16 10-15 11-18 11-19 12-20 13-21
","0-0 0-1 0-2 1-3 1-4 1-5 2-6 2-7 3-8 3-9 5-10 6-11 6-12 7-14 8-15 8-16 9-15 10-18 10-19 11-20 12-21
",6,"[('主', 8), ('体', 9)]",3,"[('臣', 8), ('民', 9)]",1,0,1,3
