ori.src,tok.ori.src,mut.src,tok.mut.src,mutkind,mutkind_word,tag,mut_align,ref,poly_word,corpus,ori.tgt,mut.tgt,isOK
"The Council President thereupon wrote a letter to the former Committee Chairperson authorizing her to work with the President of the Security Council and former members of the Committee to prepare and submit a final report.
",The Council President thereupon wrote a letter to the former Committee Chairperson authorizing her to work with the President of the Security Council and former members of the Committee to prepare and submit a final report . ,"The Council President thereupon wrote a letter to the former Committee Chairperson authorizing him to work with the President of the Security Council and former members of the Committee to prepare and submit a final report.
",The Council President thereupon wrote a letter to the former Committee Chairperson authorizing him to work with the President of the Security Council and former members of the Committee to prepare and submit a final report . ,female,"[('her', 13)]",MUTATED,"0-0,1-1,2-2,3-3,4-4,5-5,6-6,7-7,8-8,9-9,10-10,11-11,12-12,13-13,14-14,15-15,16-16,17-17,18-18,19-19,20-20,21-21,22-22,23-23,24-24,25-25,26-26,27-27,28-28,29-29,30-30,31-31,32-32,33-33,34-34,35-35,36-36,37-37","安理会主席就此写信 给前委员会主席，授权她与安全理事会主席以及前制裁委员会成员协作起草并提交最后报告。
",letter-6,UNv1,"安理会主席随后致函前委员会主席,授权她与安全理事会主席和委员会前成员合作,编写并提交最后报告。","安理会主席随后致函前委员会主席,授权他与安全理事会主席和委员会前成员合作,编写并提交最后报告。",1
"The sailors were dancing on deck, but when the prince came out of the cabin, more than a hundred rockets rose in the air, making it as bright as day.
","The sailors were dancing on deck , but when the prince came out of the cabin , more than a hundred rockets rose in the air , making it as bright as day . ","The sailors were dancing on deck, but when the princess came out of the cabin, more than a hundred rockets rose in the air, making it as bright as day.
","The sailors were dancing on deck , but when the princess came out of the cabin , more than a hundred rockets rose in the air , making it as bright as day . ",male,"[('prince', 10)]",MUTATED,"0-0,1-1,2-2,3-3,4-4,5-5,6-6,7-7,8-8,9-9,10-10,11-11,12-12,13-13,14-14,15-15,16-16,17-17,18-18,19-19,20-20,21-21,22-22,23-23,24-24,25-25,26-26,27-27,28-28,29-29,30-30,31-31,32-32,33-33,34-34","水手们在甲板上跳着舞。 当王子走出来的时候，有一百多发火箭一齐向天空射出。
",deck-5,cwmt,"水手们在甲板上跳舞, 但是当王子从小木屋出来时, 一百多枚火箭在空中升起, 使它像白天一样明亮。","水手们在甲板上跳舞, 但是当公主从小木屋出来时, 一百多枚火箭在空中升起, 使它像白天一样明亮。",1
"I stopped suddenly in case he should think that I was showing off.
",I stopped suddenly in case he should think that I was showing off . ,"I stopped suddenly in case she should think that I was showing off.
",I stopped suddenly in case she should think that I was showing off . ,male,"[('he', 5)]",MUTATED,"0-0,1-1,2-2,3-3,4-4,5-5,6-6,7-7,8-8,9-9,10-10,11-11,12-12,13-13,14-14","我突然停住,唯恐他会认为我是在炫耀.
",case-4,cwmt,我突然停下来 以防他觉得我在炫耀,我突然停下来 以防她觉得我在炫耀,1
"He bought a flat file from the hardware store.
",He bought a flat file from the hardware store . ,"She bought a flat file from the hardware store.
",She bought a flat file from the hardware store . ,male,"[('he', 0)]",MUTATED,"0-0,1-1,2-2,3-3,4-4,5-5,6-6,7-7,8-8,9-9,10-10","他从五金店买了一个扁锉.
",file-4,cwmt,他从五金店买了一个平板文件,她从五金店买了一个平板文件,1
"He's another great example that our program can reform even the toughest case.
",He 's another great example that our program can reform even the toughest case . ,"She's another great example that our program can reform even the toughest case.
",She 's another great example that our program can reform even the toughest case . ,male,"[('he', 0)]",MUTATED,"0-0,1-1,2-2,3-3,4-4,5-5,6-6,7-7,8-8,9-9,10-10,11-11,12-12,13-13,14-14,15-15","他是我们的有一个好榜样 证明我们的项目甚至能 改造最凶狠的人
",case-13,os18,"他是另一个伟大的例子, 我们的方案可以改革 即使是最艰难的案子。","她是另一个伟大的例子, 我们的方案可以改革 即使是最艰难的案子。",1
"In the meantime, he toiled all day over his plot of indigo, and at night he returned home to water his garden, and to read his books
","In the meantime , he toiled all day over his plot of indigo , and at night he returned home to water his garden , and to read his books ","In the meantime, she toiled all day over her plot of indigo, and at night she returned home to water her garden, and to read her books
","In the meantime , she toiled all day over her plot of indigo , and at night she returned home to water her garden , and to read her books ",male,"[('he', 4), ('his', 9), ('he', 17), ('his', 22), ('his', 28)]",MUTATED,"0-0,1-1,2-2,3-3,4-4,5-5,6-6,7-7,8-8,9-9,10-10,11-11,12-12,13-13,14-14,15-15,16-16,17-17,18-18,19-19,20-20,21-21,22-22,23-23,24-24,25-25,26-26,27-27,28-28,29-29,30-30","目前，他天天去培植他那方靛青地，晚上回家浇他的园子，读他的书
",plot-10,cwmt,"同时,他整天忙于他的农庄阴谋,晚上他回家给花园浇水,并阅读他的书本。","同时,她整天忙于她的农庄,晚上回家给花园浇水,阅读她的书本。",1
"He therefore requested the representatives sitting on the Third Committee to express their views on how best to treat that issue under the terms of their mandate.
",He therefore requested the representatives sitting on the Third Committee to express their views on how best to treat that issue under the terms of their mandate . ,"She therefore requested the representatives sitting on the Third Committee to express their views on how best to treat that issue under the terms of their mandate.
",She therefore requested the representatives sitting on the Third Committee to express their views on how best to treat that issue under the terms of their mandate . ,male,"[('he', 0)]",MUTATED,"0-0,1-1,2-2,3-3,4-4,5-5,6-6,7-7,8-8,9-9,10-10,11-11,12-12,13-13,14-14,15-15,16-16,17-17,18-18,19-19,20-20,21-21,22-22,23-23,24-24,25-25,26-26,27-27,28-28","因此他要求出席第三委员会的代表在他们的职权范围内，就处理这一问题最好的办法提出他们的意见。
",term-23,UNv1,"因此,他请第三委员会的与会代表就如何最好地根据其任务规定处理这一问题发表意见。","因此,她要求第三委员会的各位代表就如何最好地根据其任务规定处理这一问题发表意见。",1
"I saw you killing your father in the bathroom at that bar in my dream.
",I saw you killing your father in the bathroom at that bar in my dream . ,"I saw you killing your mother in the bathroom at that bar in my dream.
",I saw you killing your mother in the bathroom at that bar in my dream . ,male,"[('father', 5)]",MUTATED,"0-0,1-1,2-2,3-3,4-4,5-5,6-6,7-7,8-8,9-9,10-10,11-11,12-12,13-13,14-14,15-15,16-16","我在梦中看到你 在酒吧的厕所杀死你父亲
",bar-11,os18,我看见你在我梦里 在酒吧的洗手间里 杀了你的父亲,我看见你在我梦里 在酒吧的洗手间里 杀了你母亲,1
"The soldiers allegedly dragged him from the home of a friend, forced him to lie down on the ground, beat him on the stomach with a rifle butt and burned his tongue with lit cigarettes.
","The soldiers allegedly dragged him from the home of a friend , forced him to lie down on the ground , beat him on the stomach with a rifle butt and burned his tongue with lit cigarettes . ","The soldiers allegedly dragged her from the home of a friend, forced her to lie down on the ground, beat her on the stomach with a rifle butt and burned her tongue with lit cigarettes.
","The soldiers allegedly dragged her from the home of a friend , forced her to lie down on the ground , beat her on the stomach with a rifle butt and burned her tongue with lit cigarettes . ",male,"[('him', 4), ('him', 13), ('him', 22), ('his', 32)]",MUTATED,"0-0,1-1,2-2,3-3,4-4,5-5,6-6,7-7,8-8,9-9,10-10,11-11,12-12,13-13,14-14,15-15,16-16,17-17,18-18,19-19,20-20,21-21,22-22,23-23,24-24,25-25,26-26,27-27,28-28,29-29,30-30,31-31,32-32,33-33,34-34,35-35,36-36,37-37,38-38","据称，士兵们将他从一位朋友家拖走，强迫他爬在地上，用枪托打他的腹部，用点着的烟头烧他的舌头。
",butt-29,UNv1,"据称,士兵们将他从一个朋友的家中拖走,强迫他趴在地上,用枪托殴打他的胃,用点燃的香烟烧他的舌头。","据称,士兵们把她从一个朋友的家中拖走,强迫她趴在地上,用枪托打她的肚子,用点燃的香烟烧她的舌头。",1
"In particular, his delegation supported the changes proposed by the European Union, as modified by its own ceiling concept.
","In particular , his delegation supported the changes proposed by the European Union , as modified by its own ceiling concept . ","In particular, her delegation supported the changes proposed by the European Union, as modified by its own ceiling concept.
","In particular , her delegation supported the changes proposed by the European Union , as modified by its own ceiling concept . ",male,"[('his', 3)]",MUTATED,"0-0,1-1,2-2,3-3,4-4,5-5,6-6,7-7,8-8,9-9,10-10,11-11,12-12,13-13,14-14,15-15,16-16,17-17,18-18,19-19,20-20,21-21,22-22","美国 代表团 特别 支持 欧洲 联盟 提出 的 一些 修改 建议 , 不过 其中 应考 虑 到 美国 的 限额 构想 。
",change-7,cwmt,"特别是,他的代表团支持欧洲联盟提出的修改建议,修改后由欧洲联盟自己的上限概念加以修改。","特别是,她的代表团支持欧洲联盟提出的修改建议,该修改经欧洲联盟自己的上限概念修改。",1
""" I saw her eyes well up with tears. She said, ""My dear, the most important body part is your shoulder.""
",""" I saw her eyes well up with tears . She said , "" My dear , the most important body part is your shoulder . "" ",""" I saw him eyes well up with tears. He said, ""My dear, the most important body part is your shoulder.""
",""" I saw him eyes well up with tears . He said , "" My dear , the most important body part is your shoulder . "" ",female,"[('her', 3), ('she', 10)]",MUTATED,"0-0,1-1,2-2,3-3,4-4,5-5,6-6,7-7,8-8,9-9,10-10,11-11,12-12,13-13,14-14,15-15,16-16,17-17,18-18,19-19,20-20,21-21,22-22,23-23,24-24,25-25,26-26,27-27","我看她眼睛里充盈着泪水，她说：“宝贝，最重要的部位是你的肩膀。”
",tear-8,cwmt,"""我眼睁睁地看着她眼泪汪汪,她说,""亲爱的,最重要的身体部分就是你的肩膀""","""我眼睁睁地看着他流泪,他说, ""亲爱的,最重要的身体部分就是你的肩膀""",1
"Not a stitch in that embroidered letter, but she has felt it in her heart
","Not a stitch in that embroidered letter , but she has felt it in her heart ","Not a stitch in that embroidered letter, but he has felt it in him heart
","Not a stitch in that embroidered letter , but he has felt it in him heart ",female,"[('she', 9), ('her', 14)]",MUTATED,"0-0,1-1,2-2,3-3,4-4,5-5,6-6,7-7,8-8,9-9,10-10,11-11,12-12,13-13,14-14,15-15,16-16","她绣的那个宇，针针线线全都扎到她心口上呢
",letter-6,cwmt,刺绣信没有缝针 但她心里有感觉,刺绣信没有缝针 但他心里有感觉,1
"She took the bread-knife, and picked and bored at the mortar of a stone, and when she was tired, the waiting-maid took her turn
","She took the bread - knife , and picked and bored at the mortar of a stone , and when she was tired , the waiting - maid took her turn ","He took the bread-knife, and picked and bored at the mortar of a stone, and when he was tired, the waiting-maid took him turn
","He took the bread - knife , and picked and bored at the mortar of a stone , and when he was tired , the waiting - maid took him turn ",female,"[('she', 0), ('she', 20), ('her', 29)]",MUTATED,"0-0,1-1,2-2,3-3,4-4,5-5,6-6,7-7,8-8,9-9,10-10,11-11,12-12,13-13,14-14,15-15,16-16,17-17,18-18,19-19,20-20,21-21,22-22,23-23,24-24,25-25,26-26,27-27,28-28,29-29,30-30,31-31","她拿出了切面包的刀子，在石头缝的泥灰中使劲地挖呀钻呀，累了就让侍女接着干
",mortar-13,cwmt,"她拿起面包刀, 捡起一个石块的迫击炮,感到无聊, 当她疲倦时, 等候女伴转过身来,","他拿起面包刀,拿起面包刀,在石块的迫击炮上捡起和无聊,当他疲倦时,等候者带他转身",1
"There's no way he could have dodged the punch
",There 's no way he could have dodged the punch ,"There's no way she could have dodged the punch
",There 's no way she could have dodged the punch ,male,"[('he', 4)]",MUTATED,"0-0,1-1,2-2,3-3,4-4,5-5,6-6,7-7,8-8,9-9,10-10","这一拳看得到也避不到啊
",punch-9,os18,他不可能躲过拳头的,她不可能躲过拳头的,1
"The orchard project, the second crop initiative, the farmers' clubs and the women's agricultural self-help groups are all designed to be sustainable and environmentally friendly.
","The orchard project , the second crop initiative , the farmers ' clubs and the women 's agricultural self - help groups are all designed to be sustainable and environmentally friendly . ","The orchard project, the second crop initiative, the farmers' clubs and the men's agricultural self-help groups are all designed to be sustainable and environmentally friendly.
","The orchard project , the second crop initiative , the farmers ' clubs and the men 's agricultural self - help groups are all designed to be sustainable and environmentally friendly . ",female,"[('women', 15)]",MUTATED,"0-0,1-1,2-2,3-3,4-4,5-5,6-6,7-7,8-8,9-9,10-10,11-11,12-12,13-13,14-14,15-15,16-16,17-17,18-18,19-19,20-20,21-21,22-22,23-23,24-24,25-25,26-26,27-27,28-28,29-29,30-30,31-31,32-32","果园项目、第二作物倡议、农民俱乐部和妇女农业自助团体，都是为可持续和环保而设计。
",club-12,UNv1,果园项目、第二个作物倡议、农民俱乐部和妇女农业自助团体的设计都是可持续和无害环境的。,果园项目、第二个作物倡议、农民俱乐部和男子农业自助团体都设计为可持续和无害环境的。,1
"""Where any staff member of the Patent Office, or any staff member concerned of the State, acts wrongfully out of personal considerations or commits fraudulent acts, he shall be subject to disciplinary sanction by the Patent Office or the competent authority concerned.""
",""" Where any staff member of the Patent Office , or any staff member concerned of the State , acts wrongfully out of personal considerations or commits fraudulent acts , he shall be subject to disciplinary sanction by the Patent Office or the competent authority concerned . "" ","""Where any staff member of the Patent Office, or any staff member concerned of the State, acts wrongfully out of personal considerations or commits fraudulent acts, she shall be subject to disciplinary sanction by the Patent Office or the competent authority concerned.""
",""" Where any staff member of the Patent Office , or any staff member concerned of the State , acts wrongfully out of personal considerations or commits fraudulent acts , she shall be subject to disciplinary sanction by the Patent Office or the competent authority concerned . "" ",male,"[('he', 30)]",MUTATED,"0-0,1-1,2-2,3-3,4-4,5-5,6-6,7-7,8-8,9-9,10-10,11-11,12-12,13-13,14-14,15-15,16-16,17-17,18-18,19-19,20-20,21-21,22-22,23-23,24-24,25-25,26-26,27-27,28-28,29-29,30-30,31-31,32-32,33-33,34-34,35-35,36-36,37-37,38-38,39-39,40-40,41-41,42-42,43-43,44-44,45-45,46-46,47-47,48-48","专利局工作人员及有关国家工作人员徇私舞弊的,由专利局或者有关主管机关给予行政处分
",staff-12,um,"""如果专利局的任何工作人员或有关国家的任何工作人员出于个人考虑犯下不正当行为或犯有欺诈行为,他应受到专利局或有关主管当局的纪律制裁。""","""如果专利局的任何工作人员或有关国家的任何工作人员出于个人考虑犯下不正当行为或犯有欺诈行为,她应受到专利局或有关主管当局的纪律制裁。""",-2
"After three and a half hours, he looked at his watch,
","After three and a half hours , he looked at his watch , ","After three and a half hours, she looked at her watch,
","After three and a half hours , she looked at her watch , ",male,"[('he', 7), ('his', 10)]",MUTATED,"0-0,1-1,2-2,3-3,4-4,5-5,6-6,7-7,8-8,9-9,10-10,11-11,12-12,13-13","过了三小时 半,他看着他的手表,
",watch-11,um,三个半小时后 他看着手表,"三个半小时后,她看着她的表,",1
"You were perfect. He was all over my case.
",You were perfect . He was all over my case . ,"You were perfect. She was all over my case.
",You were perfect . She was all over my case . ,male,"[('he', 4)]",MUTATED,"0-0,1-1,2-2,3-3,4-4,5-5,6-6,7-7,8-8,9-9,10-10,11-11","你太完美了 他总是在责怪我
",case-9,os18,"你是完美的,他一直在处理我的案子","你是完美的,她一直在处理我的案子",1
"At this point, a fare came along and the short young puller clinched the charge. But he told the tall older man,""Come on, mate, you take it.
","At this point , a fare came along and the short young puller clinched the charge . But he told the tall older man,""Come on , mate , you take it . ","At this point, a fare came along and the short young puller clinched the charge. But she told the tall older man,""Come on, mate, you take it.
","At this point , a fare came along and the short young puller clinched the charge . But she told the tall older man,""Come on , mate , you take it . ",male,"[('he', 18)]",MUTATED,"0-0,1-1,2-2,3-3,4-4,5-5,6-6,7-7,8-8,9-9,10-10,11-11,12-12,13-13,14-14,15-15,16-16,17-17,18-18,19-19,20-20,21-21,22-22,23-23,24-24,25-25,26-26,27-27,28-28,29-29,30-30,31-31,32-32","这阵儿，来了个座儿，那个矮子先讲的价钱，可是他让了，叫着高个子：“老大哥，你拉去吧！
",charge-15,um,"到了这个时候,就来了一张票, 短短的年轻拖车手扣下了电荷, 但他告诉那个高个子的老人, “来吧,伙计,你来接吧。","到了这个时候,就来了一张票, 短短的年轻拖车手扣下了电荷。但是她告诉那个高个子的老人说, “来吧,伙计,你拿着吧。",1
"There was a holdup in the bank this afternoon,but one of the holdup men was arrested on the spot.
","There was a holdup in the bank this afternoon , but one of the holdup men was arrested on the spot . ","There was a holdup in the bank this afternoon,but one of the holdup women was arrested on the spot.
","There was a holdup in the bank this afternoon , but one of the holdup women was arrested on the spot . ",male,"[('men', 15)]",MUTATED,"0-0,1-1,2-2,3-3,4-4,5-5,6-6,7-7,8-8,9-9,10-10,11-11,12-12,13-13,14-14,15-15,16-16,17-17,18-18,19-19,20-20,21-21,22-22","今天下午发生了银行劫案,但其中一名劫匪当场被捕.
",bank-6,cwmt,今天下午银行发生抢劫 但其中一人当场被捕,今天下午银行发生抢劫 但其中一名妇女当场被捕,-4
"she exclaimed, her tears running down as she killed the birds tenderly.
","she exclaimed , her tears running down as she killed the birds tenderly . ","he exclaimed, him tears running down as he killed the birds tenderly.
","he exclaimed , him tears running down as he killed the birds tenderly . ",female,"[('she', 0), ('her', 3), ('she', 8)]",MUTATED,"0-0,1-1,2-2,3-3,4-4,5-5,6-6,7-7,8-8,9-9,10-10,11-11,12-12,13-13,14-14","她大声说，在她轻轻地把山鸡弄死的时候，眼泪流了下来。
",tear-4,cwmt,她大喊大叫 她的眼泪流下来 当她杀死小鸟时,"他大喊大叫,他流泪 流下,他杀死鸟小小小的。",-4
"In the new lease the landlord included a clause referring to the maintenance responsibilities and liability in case of property damage.
",In the new lease the landlord included a clause referring to the maintenance responsibilities and liability in case of property damage . ,"In the new lease the landlady included a clause referring to the maintenance responsibilities and liability in case of property damage.
",In the new lease the landlady included a clause referring to the maintenance responsibilities and liability in case of property damage . ,male,"[('landlord', 5)]",MUTATED,"0-0,1-1,2-2,3-3,4-4,5-5,6-6,7-7,8-8,9-9,10-10,11-11,12-12,13-13,14-14,15-15,16-16,17-17,18-18,19-19,20-20,21-21,22-22","在与房东的新租约中，包括了一条关于财物损失时维修责任和义务的条款。
",case-17,cwmt,"在新租约中,房东包括一个条款,提及财产损坏情况下的赡养责任和赔偿责任。","在新租约中,房东女房东包含一个条款,提及财产损坏情况下的维护责任和赔偿责任。",1
"From day one, she made it clear that it was time for some changes.
","From day one , she made it clear that it was time for some changes . ","From day one, he made it clear that it was time for some changes.
","From day one , he made it clear that it was time for some changes . ",female,"[('she', 4)]",MUTATED,"0-0,1-1,2-2,3-3,4-4,5-5,6-6,7-7,8-8,9-9,10-10,11-11,12-12,13-13,14-14,15-15,16-16","开学第一天她就明确表示要实施一些改革措施。
",change-14,cwmt,"从第一天起,她就明确表示,现在是进行一些修改的时候了。","从第一天起,他就明确表示,现在是进行一些修改的时候了。",1
"He once killed three men in a bar... With a pencil.
",He once killed three men in a bar ... With a pencil . ,"She once killed three women in a bar... With a pencil.
",She once killed three women in a bar ... With a pencil . ,male,"[('he', 0), ('men', 4)]",MUTATED,"0-0,1-1,2-2,3-3,4-4,5-5,6-6,7-7,8-8,9-9,10-10,11-11,12-12,13-13","{\1cHC2CECF}他曾在酒吧杀三个人 用铅笔
",bar-7,os18,他曾经在酒吧里用铅笔杀了三个人,她曾经在酒吧里用铅笔杀了三个女人,1
"She urged her audience and all young people to take active steps to bring about the needed changes in their national education systems.
",She urged her audience and all young people to take active steps to bring about the needed changes in their national education systems . ,"He urged him audience and all young people to take active steps to bring about the needed changes in their national education systems.
",He urged him audience and all young people to take active steps to bring about the needed changes in their national education systems . ,female,"[('she', 0), ('her', 2)]",MUTATED,"0-0,1-1,2-2,3-3,4-4,5-5,6-6,7-7,8-8,9-9,10-10,11-11,12-12,13-13,14-14,15-15,16-16,17-17,18-18,19-19,20-20,21-21,22-22,23-23,24-24","她敦促听众和所有青年人采取积极步骤，对本国教育制度进行必要的改革。
",change-17,UNv1,"她敦促她的听众和所有年轻人采取积极步骤,对国家教育系统进行必要的改革。","他敦促他的听众和所有年轻人采取积极步骤,对国家教育系统进行必要的改革。",1
"Thus, contrary to the allegations of the source, the Government states that he had not been detained without charge.
","Thus , contrary to the allegations of the source , the Government states that he had not been detained without charge . ","Thus, contrary to the allegations of the source, the Government states that she had not been detained without charge.
","Thus , contrary to the allegations of the source , the Government states that she had not been detained without charge . ",male,"[('he', 14)]",MUTATED,"0-0,1-1,2-2,3-3,4-4,5-5,6-6,7-7,8-8,9-9,10-10,11-11,12-12,13-13,14-14,15-15,16-16,17-17,18-18,19-19,20-20,21-21,22-22","事实上，政府同来文方的说法完全相反，政府否认有任何人不受指控而被拘留。
",charge-20,UNv1,"因此,与来文提交人的指称相反,该国政府说,他不是未经指控被拘留的。","因此,与来文提交人的指称相反,该国政府说,她不是未经指控被拘留的。",1
"On entering the room, he found his friends dancing in high spirits.
","On entering the room , he found his friends dancing in high spirits . ","On entering the room, she found her friends dancing in high spirits.
","On entering the room , she found her friends dancing in high spirits . ",male,"[('he', 5), ('his', 7)]",MUTATED,"0-0,1-1,2-2,3-3,4-4,5-5,6-6,7-7,8-8,9-9,10-10,11-11,12-12,13-13,14-14","(特定时间) 一进屋，他就发现他的朋友们在愉快地跳舞。
",spirit-12,cwmt,"在进入房间时,他发现他的朋友们在高空跳舞。","在进入房间时,她发现她的朋友们跳着高尚的舞。",1
"On the afternoon of July 8,1 981 he complained of chest pains and was taken to the dispensary.
","On the afternoon of July 8,1 981 he complained of chest pains and was taken to the dispensary . ","On the afternoon of July 8,1 981 she complained of chest pains and was taken to the dispensary.
","On the afternoon of July 8,1 981 she complained of chest pains and was taken to the dispensary . ",male,"[('he', 7)]",MUTATED,"0-0,1-1,2-2,3-3,4-4,5-5,6-6,7-7,8-8,9-9,10-10,11-11,12-12,13-13,14-14,15-15,16-16,17-17,18-18,19-19","在1981年7月8日的下午他说胸口痛，被带往医疗室。
",chest-10,cwmt,"7月8日下午,181,981人抱怨胸部疼痛,并被带到药房。","7月的下午,8,181,981人抱怨胸部疼痛,并被带到药房。",1
