ori.src,tok.ori.src,mut.src,tok.mut.src,mutkind,mutkind_word,tag,mut_align,ref,poly_word,corpus,ori.tgt,mut.tgt,isOK
"3.7 The author submits that the preliminary investigation and court proceedings in his case took a total of 10 months and 16 days.
",3.7 The author submits that the preliminary investigation and court proceedings in his case took a total of 10 months and 16 days . ,"3.7 The author submits that the preliminary investigation and court proceedings in her case took a total of 10 months and 16 days.
",3.7 The author submits that the preliminary investigation and court proceedings in her case took a total of 10 months and 16 days . ,male,"[('his', 12)]",MUTATED,"0-0,1-1,2-2,3-3,4-4,5-5,6-6,7-7,8-8,9-9,10-10,11-11,12-12,13-13,14-14,15-15,16-16,17-17,18-18,19-19,20-20,21-21,22-22,23-23,24-24","3.7 提交人称，他的案件的初步调查和庭审程序共耗时10个月零16天。
",case-13,UNv1,"3.7 提交人说,他的案件的初步调查和法庭程序总共用了10个月零16天。","3.7 提交人说,她的案件的初步调查和法庭诉讼总共花了10个月零16天。",1
"Instead, he had manoeuvred his way up through the ranks of the Bolshevik party to become supreme ruler of the Soviet Union.
","Instead , he had manoeuvred his way up through the ranks of the Bolshevik party to become supreme ruler of the Soviet Union . ","Instead, she had manoeuvred her way up through the ranks of the Bolshevik party to become supreme ruler of the Soviet Union.
","Instead , she had manoeuvred her way up through the ranks of the Bolshevik party to become supreme ruler of the Soviet Union . ",male,"[('he', 2), ('his', 5)]",MUTATED,"0-0,1-1,2-2,3-3,4-4,5-5,6-6,7-7,8-8,9-9,10-10,11-11,12-12,13-13,14-14,15-15,16-16,17-17,18-18,19-19,20-20,21-21,22-22,23-23,24-24","但他处心积虑地在布尔什 维克党的等级中步步高升， 最终成为苏联的最高统治者。
",ruler-18,os18,"相反,他却在布尔什维克党的队伍中操纵自己,成为苏联的最高统治者。","相反,她却在布尔什维克党的队伍中进行操纵,成为苏联的最高统治者。",1
"he said, hitching his chair closer. The table was not very wide.
","he said , hitching his chair closer . The table was not very wide . ","she said, hitching her chair closer. The table was not very wide.
","she said , hitching her chair closer . The table was not very wide . ",male,"[('he', 0), ('his', 4)]",MUTATED,"0-0,1-1,2-2,3-3,4-4,5-5,6-6,7-7,8-8,9-9,10-10,11-11,12-12,13-13,14-14,15-15","他说着，把他的椅子挪近了一些，那桌子本来就不大。
",chair-5,cwmt,他说:你们把他的椅子拉近一点。桌子不太宽。,"她说,把她的椅子拉近一点 桌子不太宽",1
"Then, he was seated on a chair and one officer kicked him repeatedly in the upper part of his leg.
","Then , he was seated on a chair and one officer kicked him repeatedly in the upper part of his leg . ","Then, she was seated on a chair and one officer kicked her repeatedly in the upper part of her leg.
","Then , she was seated on a chair and one officer kicked her repeatedly in the upper part of her leg . ",male,"[('he', 2), ('him', 12), ('his', 19)]",MUTATED,"0-0,1-1,2-2,3-3,4-4,5-5,6-6,7-7,8-8,9-9,10-10,11-11,12-12,13-13,14-14,15-15,16-16,17-17,18-18,19-19,20-20,21-21,22-22","然后，他被按坐在一张椅子上，一名警官反复踢打他的大腿。
",chair-7,UNv1,"然后,他坐在椅子上,一名军官在腿部上部多次踢他。","然后,她坐在椅子上,一名警官在她腿上部多次踢她。",1
"(b) Undertake appropriate measures to ensure regular attendance at schools and the reduction of drop-out rates, in particular among girls;
","( b ) Undertake appropriate measures to ensure regular attendance at schools and the reduction of drop - out rates , in particular among girls ; ","(b) Undertake appropriate measures to ensure regular attendance at schools and the reduction of drop-out rates, in particular among boys;
","( b ) Undertake appropriate measures to ensure regular attendance at schools and the reduction of drop - out rates , in particular among boys ; ",female,"[('girls', 24)]",MUTATED,"0-0,1-1,2-2,3-3,4-4,5-5,6-6,7-7,8-8,9-9,10-10,11-11,12-12,13-13,14-14,15-15,16-16,17-17,18-18,19-19,20-20,21-21,22-22,23-23,24-24,25-25,26-26","采取适当的措施，确保正常上学并且尤其降低女孩的辍学率；
",drop-16,UNv1,"(b) 采取适当措施,确保学校的正常出勤率和降低辍学率,特别是女孩的辍学率;","(b) 采取适当措施,确保学校的正常出勤率和降低辍学率,特别是男孩的辍学率;",1
"b Includes programme 25, Global social issues and policies, programme 26, Integration of social groups, and programme 27, Advancement of women, of the medium-term plan.
","b Includes programme 25 , Global social issues and policies , programme 26 , Integration of social groups , and programme 27 , Advancement of women , of the medium - term plan . ","b Includes programme 25, Global social issues and policies, programme 26, Integration of social groups, and programme 27, Advancement of men, of the medium-term plan.
","b Includes programme 25 , Global social issues and policies , programme 26 , Integration of social groups , and programme 27 , Advancement of men , of the medium - term plan . ",female,"[('women', 25)]",MUTATED,"0-0,1-1,2-2,3-3,4-4,5-5,6-6,7-7,8-8,9-9,10-10,11-11,12-12,13-13,14-14,15-15,16-16,17-17,18-18,19-19,20-20,21-21,22-22,23-23,24-24,25-25,26-26,27-27,28-28,29-29,30-30,31-31,32-32,33-33,34-34","b 包括 中期 计划 方案 25 , 全球 社会 问题 和政 策 , 方案 26 , 社会 群体 的 充分 参与 和 方案 27 , 提高 妇女 地位 。
",term-31,cwmt,b 包括中期计划方案25(全球社会问题和政策)、方案26(社会团体的融合)和方案27(提高妇女地位)。,b 包括中期计划方案25(全球社会问题和政策)、方案26(社会团体的融合)和方案27(提高男子地位)。,1
"Whilst standing in a queue at the bank, I felt strong vibes from a woman in front of me.
","Whilst standing in a queue at the bank , I felt strong vibes from a woman in front of me . ","Whilst standing in a queue at the bank, I felt strong vibes from a man in front of me.
","Whilst standing in a queue at the bank , I felt strong vibes from a man in front of me . ",female,"[('woman', 15)]",MUTATED,"0-0,1-1,2-2,3-3,4-4,5-5,6-6,7-7,8-8,9-9,10-10,11-11,12-12,13-13,14-14,15-15,16-16,17-17,18-18,19-19,20-20,21-21","站在银行排队，前面的女士让我有强烈的感应。
",bank-7,cwmt,"站在银行排队时, 我感受到一个站在我面前的女人的强烈情绪。",站在银行排队时 我感受到一个男人在我面前的强烈情绪,1
"On Monday afternoon Murray will take a four-match winning streak into his match with Ferrer.
",On Monday afternoon Murray will take a four - match winning streak into his match with Ferrer . ,"On Monday afternoon Murray will take a four-match winning streak into her match with Ferrer.
",On Monday afternoon Murray will take a four - match winning streak into her match with Ferrer . ,male,"[('his', 13)]",MUTATED,"0-0,1-1,2-2,3-3,4-4,5-5,6-6,7-7,8-8,9-9,10-10,11-11,12-12,13-13,14-14,15-15,16-16,17-17,18-18","他认为他的国家不会作错事。
",match-9,cwmt,"星期一下午,默里 将采取一个四连胜的连胜 进入他与费雷尔的比赛。","星期一下午,默里将拿一个四连胜的连胜赛 进入她与费雷尔的比赛。",-2
"I would run all the way to the wall, and at the last second I would catch sight of one of them, his face level with mine, staring at me in the dark.
","I would run all the way to the wall , and at the last second I would catch sight of one of them , his face level with mine , staring at me in the dark . ","I would run all the way to the wall, and at the last second I would catch sight of one of them, her face level with mine, staring at me in the dark.
","I would run all the way to the wall , and at the last second I would catch sight of one of them , her face level with mine , staring at me in the dark . ",male,"[('his', 24)]",MUTATED,"0-0,1-1,2-2,3-3,4-4,5-5,6-6,7-7,8-8,9-9,10-10,11-11,12-12,13-13,14-14,15-15,16-16,17-17,18-18,19-19,20-20,21-21,22-22,23-23,24-24,25-25,26-26,27-27,28-28,29-29,30-30,31-31,32-32,33-33,34-34,35-35,36-36,37-37","我会一直跑到墙边，最后一秒时突然瞄到一个守卫，他的脸和我的脸一个高度，在黑暗中盯着我。
",mine-28,um,"我会一路跑到墙上, 在最后一刻,我会看到他们中的一个, 他的脸和我一样高, 看着我在黑暗中。","我会一路跑到墙上, 在最后一刻,我会看到其中之一, 她的脸和我的一样高, 看着我在黑暗中。",1
"At the end of 1998 and in January 1999, she complained to the Parliament, to the President of the Republic, and to the Supreme Court; the Parliament and the President's administration transmitted her letters to the Supreme Court.
","At the end of 1998 and in January 1999 , she complained to the Parliament , to the President of the Republic , and to the Supreme Court ; the Parliament and the President 's administration transmitted her letters to the Supreme Court . ","At the end of 1998 and in January 1999, he complained to the Parliament, to the President of the Republic, and to the Supreme Court; the Parliament and the President's administration transmitted him letters to the Supreme Court.
","At the end of 1998 and in January 1999 , he complained to the Parliament , to the President of the Republic , and to the Supreme Court ; the Parliament and the President 's administration transmitted him letters to the Supreme Court . ",female,"[('she', 10), ('her', 37)]",MUTATED,"0-0,1-1,2-2,3-3,4-4,5-5,6-6,7-7,8-8,9-9,10-10,11-11,12-12,13-13,14-14,15-15,16-16,17-17,18-18,19-19,20-20,21-21,22-22,23-23,24-24,25-25,26-26,27-27,28-28,29-29,30-30,31-31,32-32,33-33,34-34,35-35,36-36,37-37,38-38,39-39,40-40,41-41,42-42,43-43,44-44","1998年年底和1999年1月，她向议会、共和国总统和最高法院提出申诉；议会和总统府将她的信件转交最高法院。
",letter-38,UNv1,"1998年底和1999年1月,她向议会、共和国总统和最高法院提出申诉;议会和总统行政部门将她的信件转交最高法院。","1998年底和1999年1月,他向议会、共和国总统和最高法院提出申诉;议会和总统行政部门将他的信转交最高法院。",1
"The operator swings his arm several inches, and the AMP's corresponding giant metal arm scythes a 10 -foot arc.
","The operator swings his arm several inches , and the AMP 's corresponding giant metal arm scythes a 10 -foot arc . ","The operator swings her arm several inches, and the AMP's corresponding giant metal arm scythes a 10 -foot arc.
","The operator swings her arm several inches , and the AMP 's corresponding giant metal arm scythes a 10 -foot arc . ",male,"[('his', 3)]",MUTATED,"0-0,1-1,2-2,3-3,4-4,5-5,6-6,7-7,8-8,9-9,10-10,11-11,12-12,13-13,14-14,15-15,16-16,17-17,18-18,19-19,20-20,21-21,22-22","驾驶者移动手臂几英寸，AMP金属臂会放大到10英尺。
",arm-4,um,"操作员挥动他的手臂几英寸, 和AMP的相应 巨型金属臂囊 10英尺弧。","操作员挥动她的手臂几英寸, 和AMP的相应 巨型金属臂囊 10英尺弧。",1
"""Then a spirit came forward and stood before the Lord and said, 'I will entice him.'
",""" Then a spirit came forward and stood before the Lord and said , ' I will entice him . ' ","""Then a spirit came forward and stood before the Lord and said, 'I will entice her.'
",""" Then a spirit came forward and stood before the Lord and said , ' I will entice her . ' ",male,"[('him', 18)]",MUTATED,"0-0,1-1,2-2,3-3,4-4,5-5,6-6,7-7,8-8,9-9,10-10,11-11,12-12,13-13,14-14,15-15,16-16,17-17,18-18,19-19,20-20,21-21","王上1随後有一个神灵出来、站在耶和华面前、说、我去引诱他．
",spirit-3,cwmt,"然后,一个灵魂站出来,站在主的面前,说:我必定诱惑他。","然后,一个灵魂站出来,站在主的面前,说:我必定诱惑她。",1
"2.1.11.2. Women and poverty: Bank loans or credits
",2.1.11.2 . Women and poverty : Bank loans or credits ,"2.1.11.2. Men and poverty: Bank loans or credits
",2.1.11.2 . Men and poverty : Bank loans or credits ,female,"[('women', 2)]",MUTATED,"0-0,1-1,2-2,3-3,4-4,5-5,6-6,7-7,8-8,9-9,10-10","2.1.11.2. 妇女和贫困 -- -- 银行借贷
",bank-6,UNv1,2.1.11.2. 妇女与贫穷:银行贷款或信贷,2.1.11.2. 男子与贫穷:银行贷款或信贷,1
"He uses these gadgets to solve cases using Mori-kun's voice and catch bad guys!
",He uses these gadgets to solve cases using Mori - kun 's voice and catch bad guys ! ,"She uses these gadgets to solve cases using Mori-kun's voice and catch bad guys!
",She uses these gadgets to solve cases using Mori - kun 's voice and catch bad guys ! ,male,"[('he', 0)]",MUTATED,"0-0,1-1,2-2,3-3,4-4,5-5,6-6,7-7,8-8,9-9,10-10,11-11,12-12,13-13,14-14,15-15,16-16,17-17,18-18","他靠着这些小道具 变成毛利的声音 解开案子的迷底 逮捕真凶
",case-6,os18,他用这些小玩意 用毛利的声音破案 抓坏人,她用这些小玩意 用毛利的声音破案 抓坏人,1
"She is very nervous because stock market prices are likely to fall.
",She is very nervous because stock market prices are likely to fall . ,"He is very nervous because stock market prices are likely to fall.
",He is very nervous because stock market prices are likely to fall . ,female,"[('she', 0)]",MUTATED,"0-0,1-1,2-2,3-3,4-4,5-5,6-6,7-7,8-8,9-9,10-10,11-11,12-12,13-13","股市再吹跌风,她十分紧张.
",stock-5,cwmt,"她非常紧张,因为股票市场价格可能会下跌。","他非常紧张,因为股票市场价格可能会下跌。",1
"Some members of my staff felt that I should observe the custom of bygone days and allow him to call on me.
",Some members of my staff felt that I should observe the custom of bygone days and allow him to call on me . ,"Some members of my staff felt that I should observe the custom of bygone days and allow her to call on me.
",Some members of my staff felt that I should observe the custom of bygone days and allow her to call on me . ,male,"[('him', 17)]",MUTATED,"0-0,1-1,2-2,3-3,4-4,5-5,6-6,7-7,8-8,9-9,10-10,11-11,12-12,13-13,14-14,15-15,16-16,17-17,18-18,19-19,20-20,21-21,22-22,23-23","我的几个参谋人员觉得我应遵守已往惯例，允许他来见我。
",staff-4,cwmt,"我的一些工作人员认为,我应该遵守过去几天的惯例,允许他来找我。","我的一些工作人员认为,我应该遵守过去几天的惯例,允许她来找我。",1
"- He had his arms cut off. Just hacked off. - This is not necessary.
",- He had his arms cut off . Just hacked off . - This is not necessary . ,"- She had her arms cut off. Just hacked off. - This is not necessary.
",- She had her arms cut off . Just hacked off . - This is not necessary . ,male,"[('he', 1), ('his', 3)]",MUTATED,"0-0,1-1,2-2,3-3,4-4,5-5,6-6,7-7,8-8,9-9,10-10,11-11,12-12,13-13,14-14,15-15,16-16,17-17,18-18","他的手臂被砍下来了 这完全没有必要 完全没必要
",arm-4,os18,他被砍断了胳膊 被砍断了 没必要,她的手臂被砍了 被砍了 没必要,1
"Wanting the cats to stick around, man left them pots of milk and other dainties5, and invited them into his home to share his hearth6.
","Wanting the cats to stick around , man left them pots of milk and other dainties5 , and invited them into his home to share his hearth6 . ","Wanting the cats to stick around, woman left them pots of milk and other dainties5, and invited them into her home to share her hearth6.
","Wanting the cats to stick around , woman left them pots of milk and other dainties5 , and invited them into her home to share her hearth6 . ",male,"[('man', 7), ('his', 21), ('his', 25)]",MUTATED,"0-0,1-1,2-2,3-3,4-4,5-5,6-6,7-7,8-8,9-9,10-10,11-11,12-12,13-13,14-14,15-15,16-16,17-17,18-18,19-19,20-20,21-21,22-22,23-23,24-24,25-25,26-26,27-27,28-28","为了让猫留下，人准备了成钵的牛奶和其他可口的吃食，还留它们分享家中炉灶的温暖。
",pot-10,cwmt,想要猫留在这 男人留下一壶牛奶 和其他奶水5号 并邀请他们回家分享他的心跳6号,女人想让猫留在这 留下一壶牛奶和其他奶水5 并且邀请猫咪回家分享她的心跳6,1
"He had the strange feeling that instead of lying on a comfy spring mattress he was stretched out on something hard.
",He had the strange feeling that instead of lying on a comfy spring mattress he was stretched out on something hard . ,"She had the strange feeling that instead of lying on a comfy spring mattress she was stretched out on something hard.
",She had the strange feeling that instead of lying on a comfy spring mattress she was stretched out on something hard . ,male,"[('he', 0), ('he', 14)]",MUTATED,"0-0,1-1,2-2,3-3,4-4,5-5,6-6,7-7,8-8,9-9,10-10,11-11,12-12,13-13,14-14,15-15,16-16,17-17,18-18,19-19,20-20,21-21,22-22","他有一种奇怪的感觉，他不是躺在舒适的弹簧床上，而是摊在一些很硬的东西上。
",spring-12,cwmt,"他有一种奇怪的感觉,他没有躺在舒适的春床垫上,而是被一些硬的东西拉出来。","她有一种奇怪的感觉,她没有躺在舒适的春床垫上,而是被一些硬的东西拉出来。",1
"On the even night of christmas,all of us got a present from the christmas man
","On the even night of christmas , all of us got a present from the christmas man ","On the even night of christmas,all of us got a present from the christmas woman
","On the even night of christmas , all of us got a present from the christmas woman ",male,"[('man', 16)]",MUTATED,"0-0,1-1,2-2,3-3,4-4,5-5,6-6,7-7,8-8,9-9,10-10,11-11,12-12,13-13,14-14,15-15,16-16,17-17","5.圣诞前夜, 我们每个人都从圣诞老人那儿得到了一份礼物
",present-12,cwmt,圣诞节的晚上 我们都收到圣诞男人送的礼物,"在圣诞节的晚上, 我们每个人都得到了礼物 从圣诞节的女人",-2
"He had held consultations with the Under-Secretary-General for Peacekeeping Operations so that everything necessary would be done to improve the conduct of staff.
",He had held consultations with the Under - Secretary - General for Peacekeeping Operations so that everything necessary would be done to improve the conduct of staff . ,"She had held consultations with the Under-Secretary-General for Peacekeeping Operations so that everything necessary would be done to improve the conduct of staff.
",She had held consultations with the Under - Secretary - General for Peacekeeping Operations so that everything necessary would be done to improve the conduct of staff . ,male,"[('he', 0)]",MUTATED,"0-0,1-1,2-2,3-3,4-4,5-5,6-6,7-7,8-8,9-9,10-10,11-11,12-12,13-13,14-14,15-15,16-16,17-17,18-18,19-19,20-20,21-21,22-22,23-23,24-24,25-25,26-26,27-27,28-28","在这方面，他同主管维和行动的副秘书长进行了磋商，以便尽其所能改进维和人员的行为。
",staff-26,UNv1,"他与主管维持和平行动副秘书长进行了协商,以便尽一切必要努力改善工作人员的行为。","她与主管维持和平行动副秘书长进行了协商,以便尽一切必要努力改善工作人员的行为。",1
"He sat in a chair, pipe in mouth.
","He sat in a chair , pipe in mouth . ","She sat in a chair, pipe in mouth.
","She sat in a chair , pipe in mouth . ",male,"[('he', 0)]",MUTATED,"0-0,1-1,2-2,3-3,4-4,5-5,6-6,7-7,8-8,9-9,10-10","他坐在一张椅子上, 口衔烟斗.
",chair-4,cwmt,"他坐在椅子上,嘴里有管子","她坐在椅子上,嘴里塞着管子",1
"To date, she represents the Republic Presidency Social Welfare Department in the presence of:
","To date , she represents the Republic Presidency Social Welfare Department in the presence of : ","To date, he represents the Republic Presidency Social Welfare Department in the presence of:
","To date , he represents the Republic Presidency Social Welfare Department in the presence of : ",female,"[('she', 3)]",MUTATED,"0-0,1-1,2-2,3-3,4-4,5-5,6-6,7-7,8-8,9-9,10-10,11-11,12-12,13-13,14-14,15-15,16-16","目前在以下组织代表共和国社会福利部：
",date-1,UNv1,"迄今为止,她代表共和国总统府社会福利司,出席的有:","迄今为止,他代表共和国总统府社会福利司出席下列会议:",1
"31. Her delegation had taken note of the observations of the Committee on Contributions on conversion rates (A/50/11/Add.2, para. 36).
","31 . Her delegation had taken note of the observations of the Committee on Contributions on conversion rates ( A/50/11 / Add.2 , para . 36 ) . ","31. Him delegation had taken note of the observations of the Committee on Contributions on conversion rates (A/50/11/Add.2, para. 36).
","31 . Him delegation had taken note of the observations of the Committee on Contributions on conversion rates ( A/50/11 / Add.2 , para . 36 ) . ",female,"[('her', 2)]",MUTATED,"0-0,1-1,2-2,3-3,4-4,5-5,6-6,7-7,8-8,9-9,10-10,11-11,12-12,13-13,14-14,15-15,16-16,17-17,18-18,19-19,20-20,21-21,22-22,23-23,24-24,25-25,26-26,27-27,28-28","31 . 巴哈马 代表团 注意 到会费 委员会 关于 换算率 的 意见 ( A / 50 / 11 / Add . 2 , 第36段 ) 。
",note-6,cwmt,"31. 古巴代表团注意到会费委员会关于换算率的意见(A/50/11/Add.2,第36段)。","31. 他的代表团注意到会费委员会关于换算率的意见(A/50/11/Add.2,第36段)。",1
"89. She could see no reason for separate treatment of the subjects covered in draft articles 16 and 17, both of which contained a subsidiarity rule.
","89 . She could see no reason for separate treatment of the subjects covered in draft articles 16 and 17 , both of which contained a subsidiarity rule . ","89. He could see no reason for separate treatment of the subjects covered in draft articles 16 and 17, both of which contained a subsidiarity rule.
","89 . He could see no reason for separate treatment of the subjects covered in draft articles 16 and 17 , both of which contained a subsidiarity rule . ",female,"[('she', 2)]",MUTATED,"0-0,1-1,2-2,3-3,4-4,5-5,6-6,7-7,8-8,9-9,10-10,11-11,12-12,13-13,14-14,15-15,16-16,17-17,18-18,19-19,20-20,21-21,22-22,23-23,24-24,25-25,26-26,27-27,28-28,29-29","89. 她认为毫无理由分开处理第16和17条草案所涵盖的问题，这两条都载有附属规则。
",subject-12,UNv1,"89. 她认为没有理由单独处理第16条和第17条草案所涵盖的主题,这两条草案都载有辅助规则。","89. 他认为没有理由单独处理第16条和第17条草案所涵盖的主题,这两条草案都载有辅助规则。",1
"She blushed and took a little bow and the next thirty minutes in line was pure misery for me as various parents leaving the Layaway Department, shake their heads at me and say with a smile, Your mom got you good
","She blushed and took a little bow and the next thirty minutes in line was pure misery for me as various parents leaving the Layaway Department , shake their heads at me and say with a smile , Your mom got you good ","He blushed and took a little bow and the next thirty minutes in line was pure misery for me as various parents leaving the Layaway Department, shake their heads at me and say with a smile, Your dad got you good
","He blushed and took a little bow and the next thirty minutes in line was pure misery for me as various parents leaving the Layaway Department , shake their heads at me and say with a smile , Your dad got you good ",female,"[('she', 0), ('mom', 39)]",MUTATED,"0-0,1-1,2-2,3-3,4-4,5-5,6-6,7-7,8-8,9-9,10-10,11-11,12-12,13-13,14-14,15-15,16-16,17-17,18-18,19-19,20-20,21-21,22-22,23-23,24-24,25-25,26-26,27-27,28-28,29-29,30-30,31-31,32-32,33-33,34-34,35-35,36-36,37-37,38-38,39-39,40-40,41-41,42-42,43-43","人们在离开商店前都会冲我摇头，并笑嘻嘻地对我说： “你妈妈是为你好，我敢打赌你以后再也不敢这样做了！
",bow-6,cwmt,"她脸红脸红,鞠了个小鞠躬 然后30分钟排队 对我来说是完全痛苦的","他脸红脸红,鞠了个小鞠躬 然后排了30分钟的排队 对我来说是完全痛苦的",1
"All our men accounted for. Not a single drop of blood.
",All our men accounted for . Not a single drop of blood . ,"All our women accounted for. Not a single drop of blood.
",All our women accounted for . Not a single drop of blood . ,male,"[('men', 2)]",MUTATED,"0-0,1-1,2-2,3-3,4-4,5-5,6-6,7-7,8-8,9-9,10-10,11-11,12-12,13-13","我們的人都還在 沒有一個人傷亡
",drop-9,os18,我们所有的人都有记录 没有一滴血,我们所有的女人都计算在内 一滴血都没有,1
"One was pregnant while the other had been surgically fitted with a contraceptive device in her arm.
",One was pregnant while the other had been surgically fitted with a contraceptive device in her arm . ,"One was pregnant while the other had been surgically fitted with a contraceptive device in him arm.
",One was pregnant while the other had been surgically fitted with a contraceptive device in him arm . ,female,"[('her', 15)]",MUTATED,"0-0,1-1,2-2,3-3,4-4,5-5,6-6,7-7,8-8,9-9,10-10,11-11,12-12,13-13,14-14,15-15,16-16,17-17,18-18","其中一名怀孕，另一名则在手臂上被植入了避孕装置。
",arm-16,cwmt,"其中一人怀孕,而另一人则被用外科手术在她的手臂上装上避孕器。","其中一人怀孕,而另一人则被用外科手术在手臂上装上避孕器。",-2
