ori.src,tok.ori.src,mut.src,tok.mut.src,mutkind,mutkind_word,tag,mut_align,ref,poly_word,corpus,ori.tgt,mut.tgt,isOK
"He looked from the plate-glass windows in turn at the garden and the street, in a mood of vehement self-reproach.
","He looked from the plate - glass windows in turn at the garden and the street , in a mood of vehement self - reproach . ","She looked from the plate-glass windows in turn at the garden and the street, in a mood of vehement self-reproach.
","She looked from the plate - glass windows in turn at the garden and the street , in a mood of vehement self - reproach . ",male,"[('he', 0)]",MUTATED,"0-0,1-1,2-2,3-3,4-4,5-5,6-6,7-7,8-8,9-9,10-10,11-11,12-12,13-13,14-14,15-15,16-16,17-17,18-18,19-19,20-20,21-21,22-22,23-23,24-24,25-25,26-26","隔着厚玻璃窗他轮流看着花园和大街，怀着强烈谴责自己的心情。
",plate-4,um,"他在花园和街上从玻璃玻璃窗转过身看花园和街道,情绪强烈,自暴自弃。","在花园和街道上,她从盘子玻璃窗中转过身看花园和街道,情绪强烈,自暴自弃。",1
"The frequency and secrecy of the president's golfing has infuriated some of his basketball fans.
",The frequency and secrecy of the president 's golfing has infuriated some of his basketball fans . ,"The frequency and secrecy of the president's golfing has infuriated some of her basketball fans.
",The frequency and secrecy of the president 's golfing has infuriated some of her basketball fans . ,male,"[('his', 13)]",MUTATED,"0-0,1-1,2-2,3-3,4-4,5-5,6-6,7-7,8-8,9-9,10-10,11-11,12-12,13-13,14-14,15-15,16-16,17-17","奥巴马总统暗中频频开打高尔夫的行为触怒了他的一些篮球迷.
",fan-15,cwmt,总统高尔夫球赛的频率和保密性 激怒了他的球迷,总统高尔夫球赛的频率和保密性 激怒了她的一些球迷,1
"All day he toiled on untiringly , and by the evening he had succeeded in extracting ten handfuls of plaster and fragments of stone.
","All day he toiled on untiringly , and by the evening he had succeeded in extracting ten handfuls of plaster and fragments of stone . ","All day she toiled on untiringly , and by the evening she had succeeded in extracting ten handfuls of plaster and fragments of stone.
","All day she toiled on untiringly , and by the evening she had succeeded in extracting ten handfuls of plaster and fragments of stone . ",male,"[('he', 2), ('he', 11)]",MUTATED,"0-0,1-1,2-2,3-3,4-4,5-5,6-6,7-7,8-8,9-9,10-10,11-11,12-12,13-13,14-14,15-15,16-16,17-17,18-18,19-19,20-20,21-21,22-22,23-23,24-24,25-25","他不知疲倦地整天工作着，到了傍晚时分，他已经挖出了十把水泥、石灰和碎石片。
",plaster-19,cwmt,"一天到晚,他辛辛苦苦地劳作,他拔出十块石膏和石块。","一天到晚,她辛辛苦苦地劳苦,成功地提取了十块石膏和石块。",1
"What if the bow - man's hand should tremble?
",What if the bow - man 's hand should tremble ? ,"What if the bow - woman's hand should tremble?
",What if the bow - woman 's hand should tremble ? ,male,"[('man', 5)]",MUTATED,"0-0,1-1,2-2,3-3,4-4,5-5,6-6,7-7,8-8,9-9,10-10,11-11","假如射手的手颤抖了 怎么办 ?
",bow-3,cwmt,如果弓 - 男人的手会颤抖呢?,如果弓 - 女人的手会颤抖呢?,1
"Indeed, he was in such high spirits that he even sent me a funny anecdote.
","Indeed , he was in such high spirits that he even sent me a funny anecdote . ","Indeed, she was in such high spirits that she even sent me a funny anecdote.
","Indeed , she was in such high spirits that she even sent me a funny anecdote . ",male,"[('he', 2), ('he', 9)]",MUTATED,"0-0,1-1,2-2,3-3,4-4,5-5,6-6,7-7,8-8,9-9,10-10,11-11,12-12,13-13,14-14,15-15,16-16,17-17","事实上,他的心情相当不错,甚至还给我发了个小笑话。
",spirit-7,cwmt,"事实上,他精神如此高涨 他甚至给我寄了一件有趣的事","事实上,她当时精神如此高涨 她甚至给我寄了一件有趣的事",1
"23. With regard to appointments on posts subject to geographical distribution, 80 or 46.5 per cent are female staff members.
","23 . With regard to appointments on posts subject to geographical distribution , 80 or 46.5 per cent are female staff members . ","23. With regard to appointments on posts subject to geographical distribution, 80 or 46.5 per cent are male staff members.
","23 . With regard to appointments on posts subject to geographical distribution , 80 or 46.5 per cent are male staff members . ",female,"[('female', 19)]",MUTATED,"0-0,1-1,2-2,3-3,4-4,5-5,6-6,7-7,8-8,9-9,10-10,11-11,12-12,13-13,14-14,15-15,16-16,17-17,18-18,19-19,20-20,21-21,22-22,23-23","23. 就员额受地域分配限制的任命而言，有80人或46.5％为妇女工作人员。
",staff-20,UNv1,"23. 关于按地域分配员额的任用,80%或46.5%是女性工作人员。","23. 关于按地域分配员额的任用,80%或46.5%是男性工作人员。",1
"She is a victim of the social codes, and her own discreet behavior also is an important reason for her fall.
","She is a victim of the social codes , and her own discreet behavior also is an important reason for her fall . ","He is a victim of the social codes, and him own discreet behavior also is an important reason for him fall.
","He is a victim of the social codes , and him own discreet behavior also is an important reason for him fall . ",female,"[('she', 0), ('her', 10), ('her', 20)]",MUTATED,"0-0,1-1,2-2,3-3,4-4,5-5,6-6,7-7,8-8,9-9,10-10,11-11,12-12,13-13,14-14,15-15,16-16,17-17,18-18,19-19,20-20,21-21,22-22,23-23","她是习俗的牺牲品，她的不检点行为也导致其可恶的下场。
",fall-21,cwmt,"她是社会规范的受害者,她自己的谨慎行为也是她堕落的一个重要原因。","他是社会准则的受害者,他自己的谨慎行为也是他跌倒的一个重要原因。",1
"It was a prison break organized by the terrorist group he's working with.
",It was a prison break organized by the terrorist group he 's working with . ,"It was a prison break organized by the terrorist group she's working with.
",It was a prison break organized by the terrorist group she 's working with . ,male,"[('he', 10)]",MUTATED,"0-0,1-1,2-2,3-3,4-4,5-5,6-6,7-7,8-8,9-9,10-10,11-11,12-12,13-13,14-14,15-15","他所效力的恐怖组织，策划了一次越狱。
",break-4,cwmt,这是由他合作的恐怖团伙组织的越狱事件,这是她合作的恐怖团伙组织的越狱事件,1
"Through his charities I have had three police cases filed against me alleging trespass, impersonation and intimidation.
","Through his charities I have had three police cases filed against me alleging trespass , impersonation and intimidation . ","Through her charities I have had three police cases filed against me alleging trespass, impersonation and intimidation.
","Through her charities I have had three police cases filed against me alleging trespass , impersonation and intimidation . ",male,"[('his', 1)]",MUTATED,"0-0,1-1,2-2,3-3,4-4,5-5,6-6,7-7,8-8,9-9,10-10,11-11,12-12,13-13,14-14,15-15,16-16,17-17,18-18,19-19","由于他们的“善意”，我于警察部门有所交集，我被指称非法侵入，扮演和恫吓。
",case-8,cwmt,"通过他的慈善机构,我收到三起警察起诉我的案件,指控我非法侵入、冒名顶替和恐吓。","通过她的慈善机构,我收到三起警察起诉我的案件,指控我非法侵入、冒名顶替和恐吓。",1
"At present, I know him so well, that I think him really handsome; or at least, almost so.
","At present , I know him so well , that I think him really handsome ; or at least , almost so . ","At present, I know her so well, that I think her really handsome; or at least, almost so.
","At present , I know her so well , that I think her really handsome ; or at least , almost so . ",male,"[('him', 5), ('him', 12)]",MUTATED,"0-0,1-1,2-2,3-3,4-4,5-5,6-6,7-7,8-8,9-9,10-10,11-11,12-12,13-13,14-14,15-15,16-16,17-17,18-18,19-19,20-20,21-21,22-22,23-23","现在我很了解他，觉得他确实漂亮，至少可以说几乎是漂亮的。
",present-1,cwmt,"目前,我非常了解他,我觉得他非常英俊,至少,几乎如此。","目前,我非常了解她, 我觉得她真的很英俊, 或至少,几乎如此。",1
"(a) if none of them elects to adduce evidence, each of them shall state his case in the order in which his name appears on the record;
","( a ) if none of them elects to adduce evidence , each of them shall state his case in the order in which his name appears on the record ; ","(a) if none of them elects to adduce evidence, each of them shall state her case in the order in which her name appears on the record;
","( a ) if none of them elects to adduce evidence , each of them shall state her case in the order in which her name appears on the record ; ",male,"[('his', 17), ('his', 24)]",MUTATED,"0-0,1-1,2-2,3-3,4-4,5-5,6-6,7-7,8-8,9-9,10-10,11-11,12-12,13-13,14-14,15-15,16-16,17-17,18-18,19-19,20-20,21-21,22-22,23-23,24-24,25-25,26-26,27-27,28-28,29-29,30-30,31-31","(a) 如他们无人选择援引证据，每一人均须按照其姓名或名称在纪录出现的次序而陈述其案;
",case-18,um,"(a) 如果没有人选择提出证据,则每人应按记录中姓名的先后次序陈述其案情;","(a) 如果没有人选择提出证据,则每人应按记录上她姓名的先后次序陈述她的情况;",1
"109.1 The provision of the necessary medical advice, free of charge, in the Ministry's health centres to women subjected to violence and other women in difficult social situations;
","109.1 The provision of the necessary medical advice , free of charge , in the Ministry 's health centres to women subjected to violence and other women in difficult social situations ; ","109.1 The provision of the necessary medical advice, free of charge, in the Ministry's health centres to men subjected to violence and other men in difficult social situations;
","109.1 The provision of the necessary medical advice , free of charge , in the Ministry 's health centres to men subjected to violence and other men in difficult social situations ; ",female,"[('women', 20), ('women', 26)]",MUTATED,"0-0,1-1,2-2,3-3,4-4,5-5,6-6,7-7,8-8,9-9,10-10,11-11,12-12,13-13,14-14,15-15,16-16,17-17,18-18,19-19,20-20,21-21,22-22,23-23,24-24,25-25,26-26,27-27,28-28,29-29,30-30,31-31,32-32","109.1 社会事务部的中心为暴力受害妇女及其他遭遇社会困难的妇女免费提供必要的医疗服务。
",charge-11,UNv1,109.1 在卫生部的保健中心免费向遭受暴力的妇女和其他处于社会困境的妇女提供必要的医疗咨询;,109.1 在卫生部的保健中心向遭受暴力的男子和其他处于社会困境的男子免费提供必要的医疗咨询;,1
"He had taken note of the comments made by some delegations to the effect that the current arrangement seriously threatened the future of peacekeeping activities.
",He had taken note of the comments made by some delegations to the effect that the current arrangement seriously threatened the future of peacekeeping activities . ,"She had taken note of the comments made by some delegations to the effect that the current arrangement seriously threatened the future of peacekeeping activities.
",She had taken note of the comments made by some delegations to the effect that the current arrangement seriously threatened the future of peacekeeping activities . ,male,"[('he', 0)]",MUTATED,"0-0,1-1,2-2,3-3,4-4,5-5,6-6,7-7,8-8,9-9,10-10,11-11,12-12,13-13,14-14,15-15,16-16,17-17,18-18,19-19,20-20,21-21,22-22,23-23,24-24,25-25,26-26","他注意到一些代表团提出的意见，其大意是现有安排严重威胁着维持和平活动的未来。
",note-3,UNv1,"他注意到一些代表团的评论,大意是目前的安排严重威胁到维持和平活动的未来。","她注意到一些代表团的评论,大意是目前的安排严重威胁到维持和平活动的未来。",1
"He pretended that resigning was part of his long-term career strategy.
",He pretended that resigning was part of his long - term career strategy . ,"She pretended that resigning was part of her long-term career strategy.
",She pretended that resigning was part of her long - term career strategy . ,male,"[('he', 0), ('his', 7)]",MUTATED,"0-0,1-1,2-2,3-3,4-4,5-5,6-6,7-7,8-8,9-9,10-10,11-11,12-12,13-13,14-14","他假装辞职是他长远事业规划的一部分。
",term-10,um,他假装辞职是他长期职业生涯战略的一部分。,她假装辞职是她长期职业生涯战略的一部分。,1
"It took note of the Special Rapporteur's approach to the topic and his proposed draft guidelines on use of terms, scope of the guidelines and legal status of the atmosphere.
","It took note of the Special Rapporteur 's approach to the topic and his proposed draft guidelines on use of terms , scope of the guidelines and legal status of the atmosphere . ","It took note of the Special Rapporteur's approach to the topic and her proposed draft guidelines on use of terms, scope of the guidelines and legal status of the atmosphere.
","It took note of the Special Rapporteur 's approach to the topic and her proposed draft guidelines on use of terms , scope of the guidelines and legal status of the atmosphere . ",male,"[('his', 13)]",MUTATED,"0-0,1-1,2-2,3-3,4-4,5-5,6-6,7-7,8-8,9-9,10-10,11-11,12-12,13-13,14-14,15-15,16-16,17-17,18-18,19-19,20-20,21-21,22-22,23-23,24-24,25-25,26-26,27-27,28-28,29-29,30-30,31-31,32-32,33-33","它注意到特别报告员对待这个议题的做法以及他所提议的大气层术语使用、指南范围和法律地位指南草案。
",note-2,UNv1,它注意到特别报告员对这个专题的处理方式及其提议的关于使用术语、准则范围和大气层法律地位的准则草案。,它注意到特别报告员对这个专题的处理方式以及她提议的关于使用术语、准则范围和大气层法律地位的准则草案。,1
"31. The authority granted to judges under the Personal Status Act to marry underage girls could be used only in exceptional cases.
",31 . The authority granted to judges under the Personal Status Act to marry underage girls could be used only in exceptional cases . ,"31. The authority granted to judges under the Personal Status Act to marry underage boys could be used only in exceptional cases.
",31 . The authority granted to judges under the Personal Status Act to marry underage boys could be used only in exceptional cases . ,female,"[('girls', 15)]",MUTATED,"0-0,1-1,2-2,3-3,4-4,5-5,6-6,7-7,8-8,9-9,10-10,11-11,12-12,13-13,14-14,15-15,16-16,17-17,18-18,19-19,20-20,21-21,22-22,23-23,24-24","31. 根据《人身法》而赋予法官批准未到法定年龄的女孩结婚的权力只能在特殊情况下使用。
",case-22,UNv1,31. 根据《个人地位法》赋予法官的与未成年女孩结婚的权力只能在例外情况下使用。,31. 根据《个人地位法》赋予法官的与未成年男孩结婚的权力只能在例外情况下使用。,1
"He further requests the extension of his own term of office until 31 December 2014, the date by which the Tribunal is expected to complete all its work.
","He further requests the extension of his own term of office until 31 December 2014 , the date by which the Tribunal is expected to complete all its work . ","She further requests the extension of her own term of office until 31 December 2014, the date by which the Tribunal is expected to complete all its work.
","She further requests the extension of her own term of office until 31 December 2014 , the date by which the Tribunal is expected to complete all its work . ",male,"[('he', 0), ('his', 6)]",MUTATED,"0-0,1-1,2-2,3-3,4-4,5-5,6-6,7-7,8-8,9-9,10-10,11-11,12-12,13-13,14-14,15-15,16-16,17-17,18-18,19-19,20-20,21-21,22-22,23-23,24-24,25-25,26-26,27-27,28-28,29-29,30-30","他还请求将他自己的任期延长至2014年12月31日，预计届时法庭将完成所有工作。
",term-8,UNv1,"他还请求将他本人的任期延长至2014年12月31日,即法庭预期完成其全部工作的日期。","她还请求将她的任期延长至2014年12月31日,即法庭预期完成其全部工作的日期。",1
"He scrapped APS's own preprint archive and changed copyright terms to allow posting of society-published articles in the archive.
",He scrapped APS 's own preprint archive and changed copyright terms to allow posting of society - published articles in the archive . ,"She scrapped APS's own preprint archive and changed copyright terms to allow posting of society-published articles in the archive.
",She scrapped APS 's own preprint archive and changed copyright terms to allow posting of society - published articles in the archive . ,male,"[('he', 0)]",MUTATED,"0-0,1-1,2-2,3-3,4-4,5-5,6-6,7-7,8-8,9-9,10-10,11-11,12-12,13-13,14-14,15-15,16-16,17-17,18-18,19-19,20-20,21-21,22-22,23-23","针对一类严格反馈随机时滞非线性系统，提出了一种状态反馈镇定方案。
",term-10,cwmt,"他剪掉了APS自己的预印档案,并修改了版权条款,以便能够在档案中张贴社会发表的文章。","她剪掉了APS自己的预印档案,并修改了版权条款,以便能够在档案中张贴社会发表的文章。",1
"(a) a written statement (a ""defence response"" (答辩书)) indicating, with reference to the prosecution case statement, the facts and inferences on which he takes issue with the prosecution;
","( a ) a written statement ( a "" defence response "" ( 答辩书 ) ) indicating , with reference to the prosecution case statement , the facts and inferences on which he takes issue with the prosecution ; ","(a) a written statement (a ""defence response"" (答辩书)) indicating, with reference to the prosecution case statement, the facts and inferences on which she takes issue with the prosecution;
","( a ) a written statement ( a "" defence response "" ( 答辩书 ) ) indicating , with reference to the prosecution case statement , the facts and inferences on which she takes issue with the prosecution ; ",male,"[('he', 32)]",MUTATED,"0-0,1-1,2-2,3-3,4-4,5-5,6-6,7-7,8-8,9-9,10-10,11-11,12-12,13-13,14-14,15-15,16-16,17-17,18-18,19-19,20-20,21-21,22-22,23-23,24-24,25-25,26-26,27-27,28-28,29-29,30-30,31-31,32-32,33-33,34-34,35-35,36-36,37-37,38-38,39-39","(a) 一份书面陈述(“答辩书”(defence response))，参照检控论据书而指出被控人与控方争论的事实与推论;
",case-23,um,"(a) 一份书面陈述(a) ""答辩答复""()),就检方的案情陈述,说明他对检方提出异议的事实和推论;","(a) 一份书面陈述(a) ""答辩答复""()),就检方陈述,说明她与检方有争议的事实和推断;",1
"He lost his temper when he broke the key in the lock.
",He lost his temper when he broke the key in the lock . ,"She lost her temper when she broke the key in the lock.
",She lost her temper when she broke the key in the lock . ,male,"[('he', 0), ('his', 2), ('he', 5)]",MUTATED,"0-0,1-1,2-2,3-3,4-4,5-5,6-6,7-7,8-8,9-9,10-10,11-11,12-12,13-13","给出独奏会的音乐家。
",lock-11,cwmt,他把锁里的钥匙弄坏的时候发脾气了,她打破锁里钥匙的时候发脾气了,1
"· In the case of two parties, women accounted for between 15 and 19 per cent of the membership of their institutional structures;
","· In the case of two parties , women accounted for between 15 and 19 per cent of the membership of their institutional structures ; ","· In the case of two parties, men accounted for between 15 and 19 per cent of the membership of their institutional structures;
","· In the case of two parties , men accounted for between 15 and 19 per cent of the membership of their institutional structures ; ",female,"[('women', 8)]",MUTATED,"0-0,1-1,2-2,3-3,4-4,5-5,6-6,7-7,8-8,9-9,10-10,11-11,12-12,13-13,14-14,15-15,16-16,17-17,18-18,19-19,20-20,21-21,22-22,23-23,24-24,25-25","在两个党中，妇女在机构结构的成员中所占比例在15%至19%之间；
",case-3,UNv1,"在两党中,妇女占其体制结构成员的15%至19%;","在两党中,男子占其体制结构成员的15%至19%;",1
"One fetus died about half way through term, while an 11-week-old puppy died of pneumonia after its mother accidentally bit its chest.
","One fetus died about half way through term , while an 11 - week - old puppy died of pneumonia after its mother accidentally bit its chest . ","One fetus died about half way through term, while an 11-week-old puppy died of pneumonia after its father accidentally bit its chest.
","One fetus died about half way through term , while an 11 - week - old puppy died of pneumonia after its father accidentally bit its chest . ",female,"[('mother', 22)]",MUTATED,"0-0,1-1,2-2,3-3,4-4,5-5,6-6,7-7,8-8,9-9,10-10,11-11,12-12,13-13,14-14,15-15,16-16,17-17,18-18,19-19,20-20,21-21,22-22,23-23,24-24,25-25,26-26,27-27,28-28","一个胎儿中途死了，另一个11周大的小狗在狗妈妈不小心咬了它的胸部后死于肺炎。
",term-7,cwmt,"一名胎儿在半个学期死亡,而一名11周大的小狗在母亲不小心咬到胸口后死于肺炎。","一名胎儿在半个学期死亡,而一名11周大的小狗在父亲不小心咬到胸口后死于肺炎。",1
"A friend of mine who teaches European history at Washington University in St. Louistells about the time he spotted a plagiarized term paper.
",A friend of mine who teaches European history at Washington University in St. Louistells about the time he spotted a plagiarized term paper . ,"A friend of mine who teaches European history at Washington University in St. Louistells about the time she spotted a plagiarized term paper.
",A friend of mine who teaches European history at Washington University in St. Louistells about the time she spotted a plagiarized term paper . ,male,"[('he', 17)]",MUTATED,"0-0,1-1,2-2,3-3,4-4,5-5,6-6,7-7,8-8,9-9,10-10,11-11,12-12,13-13,14-14,15-15,16-16,17-17,18-18,19-19,20-20,21-21,22-22,23-23,24-24","后来的东西只是它的发展罢了.
",mine-3,cwmt,"我的一个朋友,在圣路易斯泰尔斯华盛顿大学教授欧洲历史,他讲述了当时他看到一张被塑胶化的学期论文。","我的一个朋友在圣路易斯泰尔的华盛顿大学教授欧洲历史,",1
"22. Health-care services were offered throughout a woman's life cycle.
",22 . Health - care services were offered throughout a woman 's life cycle . ,"22. Health-care services were offered throughout a man's life cycle.
",22 . Health - care services were offered throughout a man 's life cycle . ,female,"[('woman', 10)]",MUTATED,"0-0,1-1,2-2,3-3,4-4,5-5,6-6,7-7,8-8,9-9,10-10,11-11,12-12,13-13,14-14,15-15","22. 妇女在整个生命周期中都能得到保健服务。
",cycle-13,UNv1,22. 妇女的整个生命周期都提供保健服务。,22. 男子的整个生命周期都提供保健服务。,1
"However, ordinary people always bear appearance in mind and they don't know it is trivial and should not judge a man in terms of his appearance.
","However , ordinary people always bear appearance in mind and they do n't know it is trivial and should not judge a man in terms of his appearance . ","However, ordinary people always bear appearance in mind and they don't know it is trivial and should not judge a woman in terms of her appearance.
","However , ordinary people always bear appearance in mind and they do n't know it is trivial and should not judge a woman in terms of her appearance . ",male,"[('man', 22), ('his', 26)]",MUTATED,"0-0,1-1,2-2,3-3,4-4,5-5,6-6,7-7,8-8,9-9,10-10,11-11,12-12,13-13,14-14,15-15,16-16,17-17,18-18,19-19,20-20,21-21,22-22,23-23,24-24,25-25,26-26,27-27,28-28,29-29","包含一个或多个备份设备的集合的备份构成一个媒体集。
",term-24,cwmt,"然而,普通人总是会想到外表, 他们不知道这是微不足道的, 不应该从一个人的外表来判断他。","然而,普通人总是会想到外表, 他们不知道这是微不足道的, 不应该以女性的外表来评判她。",1
"(b) Progress report on the system-wide medium-term plan for the advancement of women, 1996–2001;
","( b ) Progress report on the system - wide medium - term plan for the advancement of women , 1996–2001 ; ","(b) Progress report on the system-wide medium-term plan for the advancement of men, 1996–2001;
","( b ) Progress report on the system - wide medium - term plan for the advancement of men , 1996–2001 ; ",female,"[('women', 18)]",MUTATED,"0-0,1-1,2-2,3-3,4-4,5-5,6-6,7-7,8-8,9-9,10-10,11-11,12-12,13-13,14-14,15-15,16-16,17-17,18-18,19-19,20-20,21-21,22-22","(b) 关于1996-2001年提高妇女地位全系统中期计划的进度报告;
",term-12,UNv1,(b) 关于1996-2001年提高妇女地位全系统中期计划的进度报告;,(b) 1996-2001年全系统提高男子地位中期计划的进度报告;,1
"11. The Committee takes note of the information provided by the State party on the measures taken to combat female genital mutilation.
",11 . The Committee takes note of the information provided by the State party on the measures taken to combat female genital mutilation . ,"11. The Committee takes note of the information provided by the State party on the measures taken to combat male genital mutilation.
",11 . The Committee takes note of the information provided by the State party on the measures taken to combat male genital mutilation . ,female,"[('female', 20)]",MUTATED,"0-0,1-1,2-2,3-3,4-4,5-5,6-6,7-7,8-8,9-9,10-10,11-11,12-12,13-13,14-14,15-15,16-16,17-17,18-18,19-19,20-20,21-21,22-22,23-23,24-24","11. 委员会注意到缔约国提供的关于采取措施打击女性外阴残割行为的资料。
",note-5,UNv1,11. 委员会注意到缔约国提供的关于采取措施打击女性外阴残割的资料。,11. 委员会注意到缔约国提供的关于采取措施打击男性生殖器切割的资料。,1
