ori.src,tok.ori.src,mut.src,tok.mut.src,mutkind,mutkind_word,tag,mut_align,ref,poly_word,corpus,ori.tgt,mut.tgt,isOK
"She had a little money in the bank, with which to help her mother.
","She had a little money in the bank , with which to help her mother . ","He had a little money in the bank, with which to help him father.
","He had a little money in the bank , with which to help him father . ",female,"[('she', 0), ('her', 13), ('mother', 14)]",MUTATED,"0-0,1-1,2-2,3-3,4-4,5-5,6-6,7-7,8-8,9-9,10-10,11-11,12-12,13-13,14-14,15-15,16-16","她在银行有一点存款，用来帮助她的妈妈。
",bank-7,cwmt,她银行里有一小笔钱 用来帮她妈妈,他在银行里有一小笔钱 用来帮助他的父亲,1
"I didn't say I was coming on board. Did you tell him I was coming on board?
",I did n't say I was coming on board . Did you tell him I was coming on board ? ,"I didn't say I was coming on board. Did you tell her I was coming on board?
",I did n't say I was coming on board . Did you tell her I was coming on board ? ,male,"[('him', 13)]",MUTATED,"0-0,1-1,2-2,3-3,4-4,5-5,6-6,7-7,8-8,9-9,10-10,11-11,12-12,13-13,14-14,15-15,16-16,17-17,18-18,19-19,20-20","我没说过我要来啊 是你告诉他的吗?
",board-18,os18,我没说我要上船 你告诉他我要上船吗?,我没说我要上船 你告诉她我要上船了吗?,1
"I judge her to be at most 18.Undoubtedly, Gladiator is the most successful film of the year.
","I judge her to be at most 18.Undoubtedly , Gladiator is the most successful film of the year . ","I judge him to be at most 18.Undoubtedly, Gladiator is the most successful film of the year.
","I judge him to be at most 18.Undoubtedly , Gladiator is the most successful film of the year . ",female,"[('her', 2)]",MUTATED,"0-0,1-1,2-2,3-3,4-4,5-5,6-6,7-7,8-8,9-9,10-10,11-11,12-12,13-13,14-14,15-15,16-16,17-17,18-18,19-19","我断定她最多不过18岁。 毫无疑问，《角斗士》是本年度最成功的影片。
",film-14,cwmt,我评断她最多是18岁 无疑 角斗士是今年最成功的电影,"我判断他最多18岁, 无疑, 角斗士是今年最成功的电影。",1
"Only 19.3 per cent of MPs were women, placing the country in 70th place in terms of gender equality.
","Only 19.3 per cent of MPs were women , placing the country in 70th place in terms of gender equality . ","Only 19.3 per cent of MPs were men, placing the country in 70th place in terms of gender equality.
","Only 19.3 per cent of MPs were men , placing the country in 70th place in terms of gender equality . ",female,"[('women', 7)]",MUTATED,"0-0,1-1,2-2,3-3,4-4,5-5,6-6,7-7,8-8,9-9,10-10,11-11,12-12,13-13,14-14,15-15,16-16,17-17,18-18,19-19,20-20,21-21","英国国会议员中只有19.3%为女性，在各国性别平等排名中位列第70位。
",term-16,cwmt,"只有19.3%的议员是妇女,在两性平等方面,该国位居第70位。","只有19.3%的议员是男性,在性别平等方面,该国位居第70位。",1
"- Take a letter! - [Lisping] Yes, sir.
","- Take a letter ! - [ Lisping ] Yes , sir . ","- Take a letter! - [Lisping] Yes, madam.
","- Take a letter ! - [ Lisping ] Yes , madam . ",male,"[('sir', 11)]",MUTATED,"0-0,1-1,2-2,3-3,4-4,5-5,6-6,7-7,8-8,9-9,10-10,11-11,12-12,13-13","一我要写封信 一是 老板
",letter-3,os18,- 收信吧!,- 收信吧!,1
"My brother gave me a message, saying that My present has been put in your bedroom.
","My brother gave me a message , saying that My present has been put in your bedroom . ","My sister gave me a message, saying that My present has been put in your bedroom.
","My sister gave me a message , saying that My present has been put in your bedroom . ",male,"[('brother', 1)]",MUTATED,"0-0,1-1,2-2,3-3,4-4,5-5,6-6,7-7,8-8,9-9,10-10,11-11,12-12,13-13,14-14,15-15,16-16,17-17,18-18","我哥给我留了张条，告诉我：我的礼物已经放在你的卧室里了。
",present-10,cwmt,"我哥哥给我一个信息, 说,我的礼物 已经放在你的卧室。",我姐姐给我留言 说我的礼物已经放在你卧室里了,1
"The programme aimed to build capacity while adapting to an evolving situation, he said, and would provide the base for a longer-term programme.
","The programme aimed to build capacity while adapting to an evolving situation , he said , and would provide the base for a longer - term programme . ","The programme aimed to build capacity while adapting to an evolving situation, she said, and would provide the base for a longer-term programme.
","The programme aimed to build capacity while adapting to an evolving situation , she said , and would provide the base for a longer - term programme . ",male,"[('he', 13)]",MUTATED,"0-0,1-1,2-2,3-3,4-4,5-5,6-6,7-7,8-8,9-9,10-10,11-11,12-12,13-13,14-14,15-15,16-16,17-17,18-18,19-19,20-20,21-21,22-22,23-23,24-24,25-25,26-26,27-27,28-28","方案目标是在适应不断变化情况的同时建设能力，并为一项长期方案打基础。
",term-25,UNv1,"他说,该方案旨在建设能力,同时适应不断变化的形势,并将为长期方案奠定基础。","她说,该方案旨在建设能力,同时适应不断变化的形势,并将为长期方案奠定基础。",1
"It also commended the Government for the establishment of the Human Rights Ombudsman institution and took note of the programmes and initiatives to ensure the increased participation and equal treatment of women.
",It also commended the Government for the establishment of the Human Rights Ombudsman institution and took note of the programmes and initiatives to ensure the increased participation and equal treatment of women . ,"It also commended the Government for the establishment of the Human Rights Ombudsman institution and took note of the programmes and initiatives to ensure the increased participation and equal treatment of men.
",It also commended the Government for the establishment of the Human Rights Ombudsman institution and took note of the programmes and initiatives to ensure the increased participation and equal treatment of men . ,female,"[('women', 31)]",MUTATED,"0-0,1-1,2-2,3-3,4-4,5-5,6-6,7-7,8-8,9-9,10-10,11-11,12-12,13-13,14-14,15-15,16-16,17-17,18-18,19-19,20-20,21-21,22-22,23-23,24-24,25-25,26-26,27-27,28-28,29-29,30-30,31-31,32-32,33-33","它还赞扬塔吉克斯坦政府设立了人权监察员机构，并注意到确保加强妇女参与及平等待遇的方案和举措。
",note-16,UNv1,"它还赞扬政府设立了人权监察员机构,并注意到旨在确保妇女更多参与和平等待遇的方案和举措。","它还赞扬政府设立了人权监察员机构,并注意到确保更多男子参与和平等待遇的方案和举措。",1
"The term of office of the President of the Supreme People’s Court is the same as that of the National People’s Congress； he shall serve no more than two consecutive terms.
",The term of office of the President of the Supreme People ’s Court is the same as that of the National People ’s Congress ； he shall serve no more than two consecutive terms . ,"The term of office of the President of the Supreme People’s Court is the same as that of the National People’s Congress； she shall serve no more than two consecutive terms.
",The term of office of the President of the Supreme People ’s Court is the same as that of the National People ’s Congress ； she shall serve no more than two consecutive terms . ,male,"[('he', 25)]",MUTATED,"0-0,1-1,2-2,3-3,4-4,5-5,6-6,7-7,8-8,9-9,10-10,11-11,12-12,13-13,14-14,15-15,16-16,17-17,18-18,19-19,20-20,21-21,22-22,23-23,24-24,25-25,26-26,27-27,28-28,29-29,30-30,31-31,32-32,33-33,34-34,35-35","最高人民法院院长每届任期同全国人民代表大会每届任期相同，连续任职不得超过两届。
",term-1,cwmt,"最高人民法院院长的任期与全国人民代表大会相同,连任不得超过两届。","最高人民法院院长的任期与全国人民代表大会相同,连任不得超过两届。",1
"The drop-out rate of boys from basic schools and upper secondary schools is higher. (Table 10.3).
",The drop - out rate of boys from basic schools and upper secondary schools is higher . ( Table 10.3 ) . ,"The drop-out rate of girls from basic schools and upper secondary schools is higher. (Table 10.3).
",The drop - out rate of girls from basic schools and upper secondary schools is higher . ( Table 10.3 ) . ,male,"[('boys', 6)]",MUTATED,"0-0,1-1,2-2,3-3,4-4,5-5,6-6,7-7,8-8,9-9,10-10,11-11,12-12,13-13,14-14,15-15,16-16,17-17,18-18,19-19,20-20,21-21,22-22","基础学校和高级中学的男生退学率较高。
",drop-1,UNv1,基础学校和高中男生辍学率较高(表10.3)。,基础学校和高中女生辍学率较高(表10.3)。,1
"Well, you couldn't expect her to throw her arms round your neck her being an invalid.
","Well , you could n't expect her to throw her arms round your neck her being an invalid . ","Well, you couldn't expect him to throw him arms round your neck him being an invalid.
","Well , you could n't expect him to throw him arms round your neck him being an invalid . ",female,"[('her', 6), ('her', 9), ('her', 14)]",MUTATED,"0-0,1-1,2-2,3-3,4-4,5-5,6-6,7-7,8-8,9-9,10-10,11-11,12-12,13-13,14-14,15-15,16-16,17-17,18-18,19-19","你不能指望她撲過來緊緊擁抱你啊... 因為她身體抱恙啊
",arm-10,os18,你不可能指望她 把她的胳膊放在你的脖子上 她是个无能的人,你不能指望他把他的胳膊 套在你的脖子上 他是一个无能的。,1
"This means that she won't have to update references (or reject changes) with every iteration.
",This means that she wo n't have to update references ( or reject changes ) with every iteration . ,"This means that he won't have to update references (or reject changes) with every iteration.
",This means that he wo n't have to update references ( or reject changes ) with every iteration . ,female,"[('she', 3)]",MUTATED,"0-0,1-1,2-2,3-3,4-4,5-5,6-6,7-7,8-8,9-9,10-10,11-11,12-12,13-13,14-14,15-15,16-16,17-17,18-18,19-19","这表示，她不需要在每次迭代后更新引用（或拒绝更改）。
",change-13,cwmt,这意味着她不必在每次迭代中更新引用(或拒绝更改) 。,这意味着他不必在每次迭代中更新引用(或拒绝更改) 。,1
"It seems it's his stock in trade. No offense.
",It seems it 's his stock in trade . No offense . ,"It seems it's her stock in trade. No offense.
",It seems it 's her stock in trade . No offense . ,male,"[('his', 4)]",MUTATED,"0-0,1-1,2-2,3-3,4-4,5-5,6-6,7-7,8-8,9-9,10-10,11-11,12-12","这是他的一贯伎俩,别生气
",offense-10,os18,似乎是他的股票交易 无意冒犯,好像是她的股票交易 无意冒犯,1
"And he appoints them to 14 year terms, far longer than his own.
","And he appoints them to 14 year terms , far longer than his own . ","And she appoints them to 14 year terms, far longer than her own.
","And she appoints them to 14 year terms , far longer than her own . ",male,"[('he', 1), ('his', 12)]",MUTATED,"0-0,1-1,2-2,3-3,4-4,5-5,6-6,7-7,8-8,9-9,10-10,11-11,12-12,13-13,14-14,15-15","理事會成員的任期是14年，遠大於總統的
",term-7,os18,"他任命他们14年任期,比他自己的任期长得多。","她任命她们14年任期,比她的任期长得多。",1
"But you might as well bid a man struggling in the water rest within arm's length of the shore!
",But you might as well bid a man struggling in the water rest within arm 's length of the shore ! ,"But you might as well bid a woman struggling in the water rest within arm's length of the shore!
",But you might as well bid a woman struggling in the water rest within arm 's length of the shore ! ,male,"[('man', 7)]",MUTATED,"0-0,1-1,2-2,3-3,4-4,5-5,6-6,7-7,8-8,9-9,10-10,11-11,12-12,13-13,14-14,15-15,16-16,17-17,18-18,19-19,20-20,21-21","可是你能叫一个在水里挣扎的人在离岸只有一臂之远的时候休息一下吗！
",arm-14,cwmt,但你不如让一个在水里挣扎的人 待在岸边的手臂内!,但你不如让一个在水里挣扎的女人 待在岸边的手臂内!,1
"Well. The fact that you two are remarrying obviously has Anna overjoyed and she's very excited about the move to Switzerland.
",Well . The fact that you two are remarrying obviously has Anna overjoyed and she 's very excited about the move to Switzerland . ,"Well. The fact that you two are remarrying obviously has Anna overjoyed and he's very excited about the move to Switzerland.
",Well . The fact that you two are remarrying obviously has Anna overjoyed and he 's very excited about the move to Switzerland . ,female,"[('she', 14)]",MUTATED,"0-0,1-1,2-2,3-3,4-4,5-5,6-6,7-7,8-8,9-9,10-10,11-11,12-12,13-13,14-14,15-15,16-16,17-17,18-18,19-19,20-20,21-21,22-22,23-23,24-24","嗯。你们俩要再婚使安娜很高兴，她对到搬到瑞士去住感到很兴奋。
",move-20,cwmt,你们俩再婚的事实显然让安娜过意不去 她对搬去瑞士很兴奋,你们俩再婚的事实显然让安娜过意不去 他对搬去瑞士很兴奋,1
"To Monsieur and Madame Pabourgeot, My most respectful complements, Genflot, man of letters.
","To Monsieur and Madame Pabourgeot , My most respectful complements , Genflot , man of letters . ","To Monsieur and Madame Pabourgeot, My most respectful complements, Genflot, woman of letters.
","To Monsieur and Madame Pabourgeot , My most respectful complements , Genflot , woman of letters . ",male,"[('man', 13)]",MUTATED,"0-0,1-1,2-2,3-3,4-4,5-5,6-6,7-7,8-8,9-9,10-10,11-11,12-12,13-13,14-14,15-15,16-16,17-17","以最尊敬的敬意谨上，巴布尔若先生和夫人。
",letter-15,cwmt,敬帕博梅吉特先生和夫人 我最敬重的辅助品 根弗洛特,"敬帕博梅吉特先生和夫人,我最敬重的辅助品, 根弗洛特,信上的女人。",-4
"Xiao Er was a little slow in serving him the wine then he broke the tables and chairs
",Xiao Er was a little slow in serving him the wine then he broke the tables and chairs ,"Xiao Er was a little slow in serving her the wine then she broke the tables and chairs
",Xiao Er was a little slow in serving her the wine then she broke the tables and chairs ,male,"[('him', 8), ('he', 12)]",MUTATED,"0-0,1-1,2-2,3-3,4-4,5-5,6-6,7-7,8-8,9-9,10-10,11-11,12-12,13-13,14-14,15-15,16-16,17-17,18-18","小二小三两个送酒略慢了一点 就把桌椅板凳都打烂了
",chair-17,os18,小二给他的酒喝得有点慢 然后他把桌子和椅子打碎了,小二在为她端酒的时候 有点慢了一点 然后她把桌子和椅子打碎了,1
"At least three cases concerned human rights violations against women promoting women's rights or working to assist victims of sexual violence.
",At least three cases concerned human rights violations against women promoting women 's rights or working to assist victims of sexual violence . ,"At least three cases concerned human rights violations against men promoting men's rights or working to assist victims of sexual violence.
",At least three cases concerned human rights violations against men promoting men 's rights or working to assist victims of sexual violence . ,female,"[('women', 9), ('women', 11)]",MUTATED,"0-0,1-1,2-2,3-3,4-4,5-5,6-6,7-7,8-8,9-9,10-10,11-11,12-12,13-13,14-14,15-15,16-16,17-17,18-18,19-19,20-20,21-21,22-22,23-23","至少三起案件涉及针对促进妇女权利和努力协助性暴力受害人的妇女实施侵犯人权行为。
",case-3,UNv1,至少3起案件涉及侵犯妇女人权、促进妇女权利或帮助性暴力受害者。,至少3起案件涉及侵犯男子人权、促进男子权利或帮助性暴力受害者的工作。,1
"Accordingly, his delegation would resist any attempt to make substantive changes to the text, as that would jeopardize the results achieved to date.
","Accordingly , his delegation would resist any attempt to make substantive changes to the text , as that would jeopardize the results achieved to date . ","Accordingly, her delegation would resist any attempt to make substantive changes to the text, as that would jeopardize the results achieved to date.
","Accordingly , her delegation would resist any attempt to make substantive changes to the text , as that would jeopardize the results achieved to date . ",male,"[('his', 2)]",MUTATED,"0-0,1-1,2-2,3-3,4-4,5-5,6-6,7-7,8-8,9-9,10-10,11-11,12-12,13-13,14-14,15-15,16-16,17-17,18-18,19-19,20-20,21-21,22-22,23-23,24-24,25-25,26-26","因此，他的代表团将抵制任何对案文做实质性修改的企图，因为它将损害迄今已实现的成果。
",change-11,UNv1,"因此,美国代表团将抵制对案文作实质性修改的任何企图,因为这将危及迄今取得的成果。","因此,美国代表团将抵制对案文作实质性修改的任何企图,因为这将危及迄今取得的成果。",1
"So you think... his omega... the last letter of the greek alphabet.
",So you think ... his omega ... the last letter of the greek alphabet . ,"So you think... her omega... the last letter of the greek alphabet.
",So you think ... her omega ... the last letter of the greek alphabet . ,male,"[('his', 4)]",MUTATED,"0-0,1-1,2-2,3-3,4-4,5-5,6-6,7-7,8-8,9-9,10-10,11-11,12-12,13-13,14-14,15-15","所以你认为... 他的omega... (也作""结局""解)
",letter-9,os18,"所以,你认为... 他的欧米茄... 是希腊字母表的最后一封信",所以你觉得... 她的奥米加... 是希腊字母表的最后一封信,1
"Women must be included on equal terms in processes where the future and the financial needs of their country are being negotiated and decided upon.
",Women must be included on equal terms in processes where the future and the financial needs of their country are being negotiated and decided upon . ,"Men must be included on equal terms in processes where the future and the financial needs of their country are being negotiated and decided upon.
",Men must be included on equal terms in processes where the future and the financial needs of their country are being negotiated and decided upon . ,female,"[('women', 0)]",MUTATED,"0-0,1-1,2-2,3-3,4-4,5-5,6-6,7-7,8-8,9-9,10-10,11-11,12-12,13-13,14-14,15-15,16-16,17-17,18-18,19-19,20-20,21-21,22-22,23-23,24-24,25-25,26-26","必须让妇女平等地参与就本国的未来与财政需要进行谈判和作出决定的进程。
",term-6,UNv1,"在谈判和决定国家的未来和财政需要的过程中,必须平等地将妇女纳入进程。","在谈判和决定国家的未来和财政需要的过程中,必须平等地将男子纳入进程。",1
"The corporal in charge of the post ordered that he be given 150 blows; this was not carried out, but the other two men were beaten.
","The corporal in charge of the post ordered that he be given 150 blows ; this was not carried out , but the other two men were beaten . ","The corporal in charge of the post ordered that she be given 150 blows; this was not carried out, but the other two women were beaten.
","The corporal in charge of the post ordered that she be given 150 blows ; this was not carried out , but the other two women were beaten . ",male,"[('he', 9), ('men', 25)]",MUTATED,"0-0,1-1,2-2,3-3,4-4,5-5,6-6,7-7,8-8,9-9,10-10,11-11,12-12,13-13,14-14,15-15,16-16,17-17,18-18,19-19,20-20,21-21,22-22,23-23,24-24,25-25,26-26,27-27,28-28,29-29","负责 该 兵站 的士 官 下令 将 他 殴打 150 下 ; 但 这 一 命 令 没有 被 执行 , 但 其他 两 人 被 殴打 了 。
",charge-3,cwmt,"负责该岗哨的下士下令对他进行150次殴打;没有进行殴打,但另外两人遭到殴打。","负责该岗哨的下士下令对她进行150次殴打;没有进行殴打,但其他两名妇女遭到殴打。",1
"The patient shook her head and stretched out her hands towards the baby. The doctor put it in her arms. She kissed it on the forehead.
",The patient shook her head and stretched out her hands towards the baby . The doctor put it in her arms . She kissed it on the forehead . ,"The patient shook him head and stretched out him hands towards the baby. The doctor put it in him arms. He kissed it on the forehead.
",The patient shook him head and stretched out him hands towards the baby . The doctor put it in him arms . He kissed it on the forehead . ,female,"[('her', 3), ('her', 8), ('her', 19), ('she', 22)]",MUTATED,"0-0,1-1,2-2,3-3,4-4,5-5,6-6,7-7,8-8,9-9,10-10,11-11,12-12,13-13,14-14,15-15,16-16,17-17,18-18,19-19,20-20,21-21,22-22,23-23,24-24,25-25,26-26,27-27,28-28,29-29","病人摇了摇头，把手向婴儿伸去。医生把孩子放到她怀里。她吻了吻孩子的前额。
",arm-20,cwmt,"病人摇头向婴儿伸出手来,医生把它放在她的怀里,她亲在前额上。","病人摇着他的头,把手伸向婴儿,医生放在他的怀里,亲在前额上。",1
"Liming has lay on bed for months since his arm hurt.
",Liming has lay on bed for months since his arm hurt . ,"Liming has lay on bed for months since her arm hurt.
",Liming has lay on bed for months since her arm hurt . ,male,"[('his', 8)]",MUTATED,"0-0,1-1,2-2,3-3,4-4,5-5,6-6,7-7,8-8,9-9,10-10,11-11,12-12","李明的胳膊受了伤，已经卧床休息几个月了。
",arm-9,um,自从他的手臂受伤后 林林已经躺在床上几个月了,自她手臂受伤后 林林已经躺在床上几个月了,1
"This was the director of the bank when he was still smiling.
",This was the director of the bank when he was still smiling . ,"This was the director of the bank when she was still smiling.
",This was the director of the bank when she was still smiling . ,male,"[('he', 8)]",MUTATED,"0-0,1-1,2-2,3-3,4-4,5-5,6-6,7-7,8-8,9-9,10-10,11-11,12-12,13-13","这是这家银行的总监，那时候他还能笑得出来，
",bank-6,um,"这位是银行行长,当时他还在笑",这位是银行经理 当她还在笑的时候,1
"He notes that social capital is brought into play in times of need, risk or opportunity.
","He notes that social capital is brought into play in times of need , risk or opportunity . ","She notes that social capital is brought into play in times of need, risk or opportunity.
","She notes that social capital is brought into play in times of need , risk or opportunity . ",male,"[('he', 0)]",MUTATED,"0-0,1-1,2-2,3-3,4-4,5-5,6-6,7-7,8-8,9-9,10-10,11-11,12-12,13-13,14-14,15-15,16-16,17-17,18-18","他注意到，社会资本在有需要、有风险或有机会之时发挥作用。
",capital-4,UNv1,"他指出,社会资本是在有需要、有风险或有机会时投入使用的。","她指出,社会资本在有需要、有风险或有机会时投入使用。",1
"And immediately there fell from his eyes as it had been scales: and he received sight forthwith, and arose, and was baptized.
","And immediately there fell from his eyes as it had been scales : and he received sight forthwith , and arose , and was baptized . ","And immediately there fell from her eyes as it had been scales: and she received sight forthwith, and arose, and was baptized.
","And immediately there fell from her eyes as it had been scales : and she received sight forthwith , and arose , and was baptized . ",male,"[('his', 5), ('he', 14)]",MUTATED,"0-0,1-1,2-2,3-3,4-4,5-5,6-6,7-7,8-8,9-9,10-10,11-11,12-12,13-13,14-14,15-15,16-16,17-17,18-18,19-19,20-20,21-21,22-22,23-23,24-24,25-25,26-26","9:18 扫罗的眼睛上，好像有鳞立刻掉下来，他就能看见，于是起来受了洗。
",scale-11,cwmt,"他的眼睛忽然变成天秤一样,他忽然看见,就来了,他受洗了。","她的眼睛忽然昏倒,当时,她象一个秤子一样。她立刻就看见,就出来了,就受洗了。",1
"And after Milwaukee, your brother is now a suspect in a murder case himself.
","And after Milwaukee , your brother is now a suspect in a murder case himself . ","And after Milwaukee, your sister is now a suspect in a murder case herself.
","And after Milwaukee , your sister is now a suspect in a murder case herself . ",male,"[('brother', 5), ('himself', 14)]",MUTATED,"0-0,1-1,2-2,3-3,4-4,5-5,6-6,7-7,8-8,9-9,10-10,11-11,12-12,13-13,14-14,15-15,16-16","米尔沃基案件之后 你弟弟也成了谋杀案的嫌犯
",case-13,os18,在密尔沃基之后 你弟弟现在是谋杀案的嫌疑人,在密尔沃基之后 你妹妹现在成了谋杀案的嫌疑人,1
"He was shot in the head, the back, and the arms.
","He was shot in the head , the back , and the arms . ","She was shot in the head, the back, and the arms.
","She was shot in the head , the back , and the arms . ",male,"[('he', 0)]",MUTATED,"0-0,1-1,2-2,3-3,4-4,5-5,6-6,7-7,8-8,9-9,10-10,11-11,12-12,13-13,14-14","288)}他的頭部、背部，還有手臂都被子彈擊中
",arm-12,os18,他的头部、背部和手臂中弹。,她的头部、背部和手臂中弹。,1
"Do you know how many man hours we spent on this case?
",Do you know how many man hours we spent on this case ? ,"Do you know how many woman hours we spent on this case?
",Do you know how many woman hours we spent on this case ? ,male,"[('man', 5)]",MUTATED,"0-0,1-1,2-2,3-3,4-4,5-5,6-6,7-7,8-8,9-9,10-10,11-11,12-12,13-13","你知道我们在这件事上花了多少工时吗？
",case-11,os18,你知道我们在这个案子上花了多少个男人工时吗?,你知道我们在这个案子上 花了多少个女人小时吗?,-4
"I've n'ver ev'n had a date wi' her!
",I 've n'ver ev'n had a date wi ' her ! ,"I've n'ver ev'n had a date wi' him!
",I 've n'ver ev'n had a date wi ' him ! ,female,"[('her', 9)]",MUTATED,"0-0,1-1,2-2,3-3,4-4,5-5,6-6,7-7,8-8,9-9,10-10,11-11","卻從來連一次約會都沒有過
",date-6,os18,我从来没有约会过她!,我从来没有约会过他!,1
"If you see anyone loitering near the bank, bring him in.
","If you see anyone loitering near the bank , bring him in . ","If you see anyone loitering near the bank, bring her in.
","If you see anyone loitering near the bank , bring her in . ",male,"[('him', 10)]",MUTATED,"0-0,1-1,2-2,3-3,4-4,5-5,6-6,7-7,8-8,9-9,10-10,11-11,12-12,13-13","有一天, 在商场门口的水果档买水果.
",bank-7,cwmt,如果你看到有人在银行附近闲逛 把他带进来,如果你看到有人在银行附近闲逛 把她带进来,1
